"","Course Code","Course Name","Course Description","Prerequisite","Antirequisite","Corequisite","Note","Other Information","Lecture","Lab","Test Slot","Tutorial","Project","Reading","Studio","Credit Amount"
"1","MTHEL 99","First-Year Mathematics Readiness","A skills-based course designed to help the incoming university student refresh their knowledge of secondary school mathematics. It includes extra practice with the following topics: inequalities and absolute values, radicals and rational expressions, trigonometry, exponential and logarithmic functions, polynomials, and introductory calculus.","","","","[Note: This course will be graded on a Credit/No-Credit basis.]"," Also offered Online",TRUE,FALSE,FALSE,FALSE,FALSE,FALSE,FALSE,0
"2","MTHEL 131","Introduction to Actuarial Practice","Individual life insurance products. Introduction to property and casualty insurance. Introductory risk management, insurance pricing and valuation. Pension plan design. [Offered: F,W,S]","Prereq: 4U Calculus and Vectors","","",""," ",TRUE,FALSE,TRUE,FALSE,FALSE,FALSE,FALSE,3
"3","MTHEL 198","Mathematics Elective Topics 1","Special topics course as announced by the department.","","","",""," ",FALSE,FALSE,FALSE,FALSE,FALSE,FALSE,FALSE,3
"4","MTHEL 206","Introduction to Mathematics Education","Current trends in education, professional practices and administration, the role of the department head, lesson planning, techniques of teaching, evaluation of students, special students, extracurricular activities, the relationship between elementary and secondary school mathematics, audio-visual materials. [Offered: S]","Prereq: Mathematics Teaching students only","","",""," ",TRUE,FALSE,FALSE,FALSE,FALSE,FALSE,FALSE,3
"5","MTHEL 298","Mathematics Elective Topics 2","Special topics course as announced by the department.","","","",""," ",FALSE,FALSE,FALSE,FALSE,FALSE,FALSE,FALSE,3
"6","MTHEL 300","Professional Communications in Statistics and Actuarial Science","This course introduces students to oral and written communication in the fields of statistics and actuarial science. With emphasis on the public presentation of technical knowledge, the ability to give and receive constructive feedback, and communication in a collaborative environment, this course helps students develop proficiencies in critical workplace skills. This course is writing intensive and includes extensive collaborative assignments.","Prereq: At least 70% in one of EMLS 101R, 102R, EMLS/ENGL 129R, ENGL 109, SPCOM 100, 223; one of STAT 331, 371, ACTSC 331; Actuarial Science or Statistics major students","","","[Note: Students are encouraged to complete this course by their 4A term. Offered: F,W,S]","Department Consent Required(Cross-listed with ENGL 378)Also offered at St. Jerome's University",TRUE,FALSE,FALSE,FALSE,FALSE,FALSE,FALSE,3
"7","MTHEL 398","Mathematics Elective Topics 3","Special topics course as announced by the department.","","","",""," ",TRUE,FALSE,FALSE,FALSE,FALSE,FALSE,FALSE,3
"8","MTHEL 498","Mathematics Elective Topics 4","Special topics course as announced by the department.","","","",""," ",FALSE,FALSE,FALSE,FALSE,FALSE,FALSE,FALSE,3
