"","Course Code","Course Name","Course Description","Credit Amount","Antirequisite","Corequisite","Prerequisite","Hours","Lecture","Lab","Tutorial","Note"
"1","MA100","Introductory Calculus for the Natural Sciences","This course concentrates on developing mastery of pre-calculus and introductory calculus skills and techniques. Pre-calculus topics include: solving equations and inequalities; algebraic, trigonometric, logarithmic and exponential functions and their properties. Calculus topics include: rates of change and tangents; differentiation of algebraic, trigonometric, exponential and logarithmic functions; integration; and techniques of integration.",3,"Prior credit for, or current enrollment in, any of MA101, MA102, MA103, MA110*, MA129. This course may not count for credit in Mathematics programs.","","SC101, or a minimum score of 50% on the Calculus Preparation Evaluation (CPE) and 12U Advanced Functions.","Hours per week:Lecture/Discussion: 3Lab: 1.5",TRUE,TRUE,FALSE,""
"2","MA101","Calculus I for the Natural Sciences","Review of algebra and trigonometry. Differential calculus of the algebraic, exponential, logarithmic, trigonometric and inverse trigonometric functions of a single variable; introduction to integral calculus; techniques of integration. Introduction to ordinary differential equations. Polar coordinates. Complex numbers. Applications to problems in the natural sciences are emphasized.",3,"Prior credit for, or current enrollment in, any of: MA103, MA110*. This course may not count for credit in Mathematics programs.","","MA100 or permission of the department.","Hours per week:Lecture/Discussion: 3Lab: 1.5",TRUE,TRUE,FALSE,""
"3","MA102","Introduction to Functions and Differential Calculus","Rational, algebraic, trigonometric, logarithmic and exponential functions; equations and inequalities involving them. Thorough introduction to limits of functions. Continuity and its consequences. Introduction to differential calculus.",3,"Prior credit for, or current enrollment in, any of MA100, MA101, MA103, MA110*, MA129.","","Completion of the Calculus Preparation Evaluation (CPE) and 12U Advanced Functions.","Hours per week:Lecture/Discussion: 3Lab: 1.5",TRUE,TRUE,FALSE,"Unlike MA103, MA102 does not have Grade 12 Calculus as a prerequisite."
"4","MA103","Calculus I","Limits and continuity; differential and integral calculus of functions of a single variable; the Mean Value Theorem; determination of extrema; the Fundamental Theorem of Calculus and techniques of integration; introduction to series.",3,"MA101, MA110*.","","MA102, or a minimum score of 75% on the Calculus Preparation Evaluation (CPE) and one of MA100, MA129, Grade 12 Calculus.","Hours per week:Lecture/Discussion: 3Lab: 1.5",TRUE,TRUE,FALSE,""
"5","MA104","Calculus II","Applications of integration; polar coordinates and parametric equations; infinite sequences and series; applications of partial derivatives.",3,"MA200.","","MA101 or MA103.","Hours per week:Lecture/Discussion: 3Lab: 1.5",TRUE,TRUE,FALSE,""
"6","MA120","Introduction to Discrete Structures","Introduction to sets, functions and relations; elementary logic including logical connectives; proof techniques and induction; basic number theory and applications; basic counting and combinatorics.",3,"MA121.","","","Hours per week:Lecture/Discussion: 3",TRUE,FALSE,FALSE,""
"7","MA121","Introduction to Mathematical Proofs","An introduction to proofs and to mathematical writing. Methods of proof, such as direct proofs, proofs by contradiction, contrapositive proofs, counterexamples and mathematical induction. Examples of proofs will be illustrated using sets, functions and elementary number theory. Use of precise mathematical language will be emphasized.",3,"MA120.","","0.5 credit in MA (one of MA101, MA102, MA103, MA122, or MA170)","Hours per week:Lecture/Discussion: 3Lab: 1",TRUE,TRUE,FALSE,""
"8","MA122","Introductory Linear Algebra","Vector geometry in R² and R³ ; the vector space Rn and its subspaces; spanning sets, linear independence, bases and dimension; dot product in Rn ; systems of linear equations and Gaussian elimination; matrices and matrix operations, matrix inverse; matrix rank; linear transformations in Rn ; introduction to determinants, Cramer's rule; introduction to eigenvalues, eigenvectors and diagonalization of real matrices; applications of linear algebra.",3,"","","","Hours per week:Lecture/Discussion: 3Lab: 1",TRUE,TRUE,FALSE,""
"9","MA127","Mathematics for Business Technology Management","This course covers the basic mathematical concepts used in business. Topics will include basic algebra; ratios; solving and manipulating equations; functions and graphs; inequalities; introduction to linear algebra and matrices; inverse of a matrix; an introduction to linear programming; simple and compound interest; annuities.",3,"This course does not satisfy mathematics requirements outside of the Business Technology Management program.","Honours Business Technology Management program","Grade 12 U-level math course or equivalent.","Hours per week:Lecture/Discussion: 3Tutorial/Seminar: 1.5",TRUE,FALSE,TRUE,"This course should not be counted towards qualifying for a teachable in mathematics."
"10","MA129","Introductory Calculus for Business and Social Sciences","This course concentrates on developing mastery of pre-calculus and introductory calculus skills and techniques. Pre-calculus topics include: solving equations and inequalities; algebraic, logarithmic and exponential functions and their properties; matrix representation and solution of systems of linear equations. Calculus topics include: rates of change and tangents; differentiation of algebraic, exponential and logarithmic functions; optimization; introduction to integration.",3,"Prior credit for, or current enrollment in, any of: MA100, MA101, MA102, MA103, MA110*. This course may not count for credit in mathematics programs. This course may not count for credit in mathematics programs.","","Completion of the Calculus Preparation Evaluation (CPE) and 12U Advanced Functions or permission of the department.","Hours per week:Lecture/Discussion: 3Lab: 1.5",TRUE,TRUE,FALSE,""
"11","MA170","Introduction to Mathematics for Finance","An introduction to the theory of interest. Mathematical models and their analysis for problems involving fixed interest rates. Simple and compound interest. Cash flows, annuities, amortization and sinking funds. (Zero-)coupon bonds.",3,"","","12U Advanced Functions, or equivalent, or permission of the department.","Hours per week:Lecture/Discussion: 3Lab: 1.5",TRUE,TRUE,FALSE,""
"12","MA200","Advanced Calculus","Infinite sequences and series; Taylor and Maclaurin series; partial derivatives (limits and continuity, tangent planes, linear approximations, chain rule, directional derivative, gradient, max/min values, Lagrange multipliers); multiple integrals (double integrals, iterated integrals, triple integrals, polar/spherical coordinates).",3,"MA104 and MA201.","","MA122 and one of MA101, MA103.","Hours per week:Lecture/Discussion: 3Lab: 1.5 (biweekly)",TRUE,TRUE,FALSE,""
"13","MA201","Multivariable Calculus","Vector functions; differential and integral calculus of functions of several variables, including vector fields; line and surface integrals including Green's Theorem, Stokes' Theorem and the Divergence Theorem.",3,"MA200.","","MA122, and one of MA101, MA103. MA104 is recommended.","Hours per week:Lecture/Discussion: 3Lab: 1.5 (biweekly)",TRUE,TRUE,FALSE,""
"14","MA205","Differential Equations I","First order differential equations; linear differential equations of second and higher order; methods of undetermined coefficients and variation of parameters; Laplace transforms; power series solutions.",3,"","","MA101 or MA103.","Hours per week:Lecture/Discussion: 3Lab: 1.5 (biweekly)",TRUE,TRUE,FALSE,""
"15","MA207","Introduction to Mathematical Software","This course provides an introduction to the use of several commercial and open-source software packages which are useful to mathematics students and professional mathematicians. The students will acquire a knowledge of basic programming concepts through computer-aided lectures and projects and learn how to use each system for symbolic and numerical problem solving and visualization. Examples will be taken from linear algebra (operations with vectors and matrices, solving linear equations), discrete mathematics (elementary combinatorics, basic graphs), visualization of functions, numerical solution of nonlinear equations, descriptive statistics, elementary probability and simulations. The software (e.g. Maple, Matlab, R) presented in the course will enhance each student's presentation, visualization, and problem-solving skills.",3,"","","MA103, MA122","Hours per week:Lecture/Discussion: 3Lab: 1.5 (biweekly)",TRUE,TRUE,FALSE,""
"16","MA215","Set Theory","Equivalence relations and partitions; countable and uncountable sets; ordered sets; development of number systems.",3,"","","MA121.","Hours per week:Lecture/Discussion: 3",TRUE,FALSE,FALSE,""
"17","MA218","Euclidean Geometry","Elements of Euclidean geometry emphasizing the axiomatic approach; geometric shapes and measurements; Euler line and nine point circle; straightedge and compass constructions; transformations in Euclidean geometry; notions of non-Euclidean geometries.",3,"","","MA121","Hours per week:Lecture/Discussion: 3",TRUE,FALSE,FALSE,""
"18","MA220","Mathematics for Data Analysis and Computing","This is an introductory course in mathematical methods with an aim of addressing problems arising from the data analysis, computing and modelling. Selected topics from matrix algebra, discrete mathematics and calculus will be presented.",3,"","","One of MA101, MA103","Hours per week:Lecture/Discussion: 3",TRUE,FALSE,FALSE,"Course is offered online only"
"19","MA222","Linear Algebra","Abstract vector spaces, bases and dimension; linear transformations, matrix of a linear transformation, kernel, range, dimension theorem; change of basis; inner product spaces; orthogonal bases; Gram-Schmidt orthogonalization process; brief review of polynomials; eigenvalues, eigenvectors and diagonalizability of a linear operator; quadratic forms, Sylvester's law of inertia.",3,"","","MA122 and either MA120 or MA121.","Hours per week:Lecture/Discussion: 3Lab: 1.5 (biweekly)",TRUE,TRUE,FALSE,""
"20","MA233","Problem Solving in Mathematics","A comprehensive study of techniques in mathematical problem solving, including topics from classical and contemporary mathematics. Examples will be taken from such areas as calculus, algebra, logic, geometry, elementary number theory, combinatorics and graph theory. Problems from various mathematical contests and competitions will be discussed.",3,"","","MA103 (or MA110), MA121.","Hours per week:Lecture/Discussion: 3",TRUE,FALSE,FALSE,""
"21","MA235","Introduction to Game Theory","An introduction to game-theoretic methods and their applications. Topics include the preference relation and von Neumann-Morgenstern utility, non-cooperative games in strategic form and extensive form, perfect and imperfect information, complete and incomplete information, and cooperative game theory including bargaining solutions and the Shapley value. Illustrative examples include game models from economics, political science, business, and other disciplines.",3,"","","MA101 or MA103 or MA129.","Hours per week:Lecture/Discussion: 3",TRUE,FALSE,FALSE,""
"22","MA238","Discrete Mathematics","Basic graph theory, Euler circuits and Hamilton cycles in graphs, planar graphs, graph colouring, trees, relations, partial orders, introduction to counting, recurrence relations, inclusion-exclusion.",3,"","","MA122 and either MA120 or MA121.","Hours per week:Lecture/Discussion: 3Tutorial/Seminar: 1.5 (biweekly)",TRUE,FALSE,TRUE,""
"23","MA250","Introduction to Analysis","A rigorous development of calculus. Topics include sequences, series, convergence, limits, continuity, differentiability, and the Riemann integral.",3,"","","MA121 and MA103.","Hours per week:Lecture/Discussion: 3Lab: 1.5 (biweekly)",TRUE,TRUE,FALSE,""
"24","MA270","Financial Mathematics I","An introduction to mathematical methods from linear algebra, calculus, and probability theory used in the financial analysis of problems in areas such as bond pricing, capital budgeting, making decisions under certainty/uncertainty, utility theory, portfolio optimization, binomial and log-normal asset pricing models, introductory no-arbitrage pricing of forwards and options, risk analysis.",3,"","","MA103 (or MA110), MA122, MA170, ST259 (or MA240) or a similar course in probability and statistics (e.g., BU205 (EC205), BU255 (EC255), EC285).","Hours per week:Lecture/Discussion: 3Lab: 1.5 (biweekly)",TRUE,TRUE,FALSE,""
"25","MA287","Mathematical Models for Natural Sciences","This is an introductory course in mathematical models with an aim of addressing problems arising from the natural sciences. Selected topics from linear algebra, differential equations, and multivariate calculus will be presented along with models used in chemistry, biology, and health sciences.",3,"This course may not count for credit in Mathematics programs.","","One of MA101, MA103, MA110*.","Hours per week:Lecture/Discussion: 3Lab: 1.5 (biweekly)",TRUE,TRUE,FALSE,"Not open to students in mathematics, computer science, and physics programs."
"26","MA304","Introduction to Complex Analysis","Functions of a complex variable; transformations; integration; Taylor and Laurent expansions; theory of residues.",3,"","","MA104 and MA201","Hours per week:Lecture/Discussion: 3",TRUE,FALSE,FALSE,""
"27","MA305","Differential Equations II","Numerical solutions of differential equations and boundary value problems; linear systems of differential and difference equations including their solution by matrix methods and their stability; introduction to dynamical systems. Numerical methods will be illustrated by exercises requiring the use of a computer.",3,"MA308.","","MA122, MA104 or MA200, MA205 and either a 0.5 credit in computer programming or permission of the department.","Hours per week:Lecture/Discussion: 3",TRUE,FALSE,FALSE,""
"28","MA306","Partial Differential Equations I (Partial Differential Eqns I)","First order partial differential equations and the method of characteristics. Fourier series and convergence. Separation of variables for diffusion, wave and Laplace equations. Eigenfunction series solutions. Generalized functions and Greens functions for one-dimensional boundary value problems. Fourier transform and convolution.",3,"MA455, MA406","","MA205; and either MA200 or both MA104 and MA201.","Hours per week:Lecture/Discussion: 3",TRUE,FALSE,FALSE,""
"29","MA307","Numerical Analysis","Numerical solution of equations and systems of equations; numerical integration and solving differentialequations; methods of interpolation, extrapolation and curve-fitting; error analysis. Methods will be illustrated by exercises requiring the use of a computer.",3,"CP315, MA371, PC315.","","MA122, MA205; either CP104 or MA207; either MA200 or both MA104 and MA201.","Hours per week:Lecture/Discussion: 3Lab: 2 (biweekly)",TRUE,TRUE,FALSE,""
"30","MA317","Number Theory","Elementary theory of numbers; arithmetic functions; congruences; quadratic reciprocity; solutions to Diophantine equations.",3,"","","MA121 and 1.0 credit of 200 level Mathematics.","Hours per week:Lecture/Discussion: 3",TRUE,FALSE,FALSE,""
"31","MA318","Geometry","Survey of non-Euclidean geometries; coordinate geometry; projective, hyperbolic and affine geometries; Desargues', Pappus' and Pascal's Theorems; models of non-Euclidean geometries (spherical model, Poincaré disc and half-plane models); transformations; elements of finite geometry.",3,"","","MA218 and MA222.","Hours per week:Lecture/Discussion: 3",TRUE,FALSE,FALSE,""
"32","MA323","Introduction to Groups and Rings","Examples and basic properties of groups and rings including their substructures, quotient structures and homomorphisms.",3,"","","MA215 or MA222.","Hours per week:Lecture/Discussion: 3",TRUE,FALSE,FALSE,""
"33","MA338","Graph Theory","Selected topics may include graph colouring, extremal graph theory, planar graphs, random graphs, network flows, algebraic methods in graph theory, Ramsay theory for graphs, matching theory, graph algorithms; application of graph theory, such as applications to scheduling, VLSI circuits, compiler design, computer vision and the design of internet search engines.",3,"","","MA238.","Hours per week:Lecture/Discussion: 3",TRUE,FALSE,FALSE,""
"34","MA339","Directed Studies in Mathematics","",3,"","","Permission of the department.††","",FALSE,FALSE,FALSE,"Irregular course"
"35","MA350","Real Analysis","Topics in metric spaces including open and closed sets, compactness, uniform continuity. Sequences and series of functions. The Riemann-Stieltjes integral. Introduction to Lebesgue integration.",3,"MA303.","","MA250.","Hours per week:Lecture/Discussion: 3",TRUE,FALSE,FALSE,""
"36","MA355","Continuous and Discrete Transforms","Properties of continuous and discrete Fourier transforms; the Sampling Theorem; Inverse Fourier Transforms and convolution; introduction to wavelet analysis; Fast Fourier Transform (FFT), Fourier-Cosine (COS) method, and other algorithms; Laplace transform. Applications will be selected from applied sciences and quantitative finance.",3,"MA255.","","MA201 and MA205.","Hours per week:Lecture/Discussion: 3Lab: 1.5 (biweekly)",TRUE,TRUE,FALSE,""
"37","MA360","Topics in Applied Mathematics","The formulation, analysis and interpretation of mathematical models in various areas of application. Possible topics include population modelling, fluid mechanics, classical and quantum systems, reactiondiffusion models, neural networks, discrete optimization, and signal and image processing. Mathematical techniques may include differential and difference equations, PDEs, Fourier analysis, optimization, game theory, calculus of variations, and numerical methods. Topics covered may vary from year to year.",3,"","","MA205, MA222, and one of MA200, MA201, MA250.","Hours per week:Lecture/Discussion: 3",TRUE,FALSE,FALSE,""
"38","MA361","Methods in Applied Mathematics","Regular and singular perturbation methods. Calculus of variations including extrema and Hamiltons principle. Mathematical formulation of classical mechanics. May include: Lagrangian and Hamiltonian dynamics and constraints; introduction to control theory and the Hamilton-Jacobi-Bellman equation with applications.",3,"","","MA205 and either MA200 or MA201.","Hours per week:Lecture/Discussion: 3",TRUE,FALSE,FALSE,""
"39","MA370","Financial Mathematics II","Discrete-time financial models and riskless asset pricing. Notion of arbitrage, martingale measure, and complete and incomplete markets. Fundamental theorems of asset pricing. Static and dynamic hedging and replication. Change of numeraire and equivalent martingale measures. Introduction to options and risk-neutral pricing. Stopping times and American option pricing. Introduction to the Black-Scholes theory and sensitivity analysis for options. Optional topics: introduction to single-factor interest rate modelling and pricing of fixed income securities.",3,"","ST359.","MA270.","Hours per week:Lecture/Discussion: 3Tutorial/Seminar: 1.5 (biweekly)",TRUE,FALSE,TRUE,""
"40","MA371","Computational Methods for Data Analysis","The course covers computational techniques used in data analysis. All topics are illustrated with the use of R and/or Matlab. Topics may include some of the following: numerical linear algebra (solving linear systems, eigenvalue problem, factorization), methods of interpolation and curve-fitting, numerical optimization methods, statistical modelling (simulation of random variables and processes, introductory computational statistics).",3,"CP315, MA307, PC315.","","CP104 or MA207;, MA200 or both MA104 and MA201; ST230 or ST260.","Hours per week:Lecture/Discussion: 3Lab: 2 (biweekly)",TRUE,TRUE,FALSE,""
"41","MA372","Optimization","Linear programming algorithms, duality theory and post-optimum sensitivity analysis. Integer programming. Deterministic and stochastic dynamic programming. Kuhn-Tucker conditions for optimality. Quadratic programming. Non-linear programming. Network optimization. Modeling and applications.",3,"","","MA201, MA222.","Hours per week:Lecture/Discussion: 3",TRUE,FALSE,FALSE,""
"42","MA373","Introduction to Actuarial Mathematics","Survival distributions, life tables, life annuities, and life insurance. Calculation of premiums and reserves. Introduction to policy valuation.",3,"MA273","","MA103 (or MA110), MA170, ST259 (or MA240) or a similar course in probability and statistics such as BU255 (EC255) and EC285.","Hours per week:Lecture/Discussion: 3",TRUE,FALSE,FALSE,""
"43","MA395","Special Topics","",3,"","","Permission of the department.","",FALSE,FALSE,FALSE,"Irregular course"
"44","MA405","Dynamical Systems","Existence and uniqueness of solutions of ODEs, equilibria, linearization, bifurcation, stability methods, centre manifold theory. Other topics may include: delay/feedback equations, strange attractors and deterministic chaos, symmetry, Hamiltonian dynamics.",3,"","","MA250, MA305","Hours per week:Lecture/Discussion: 3",TRUE,FALSE,FALSE,""
"45","MA406","Partial Differential Equations II (Partial Differential Eqns II)","Canonical forms of linear second order PDEs. Ill-posed and well-posed problems. General framework for linear PDEs: self-adjoint and positive definite linear operators, minimization principle, Rayleigh quotient, Eigenfunction series. Greens functions in the planar case; delta-function in higher dimensions. Introduction to numerical methods for PDEs.Additional topics may include: Weak solutions. Linear and nonlinear evolution equations, linearization and stability. Heat and forced heat equations, maximum principle. Nonlinear diffusion. Dispersion and solitons.",3,"MA455","","MA222, MA250, MA306","Hours per week:Lecture/Discussion: 3",TRUE,FALSE,FALSE,""
"46","MA418","Differential Geometry","Geometry of curves and surfaces, curvature, geodesics, first and second fundamental forms, the Gauss Theorema Egregium and the Gauss-Bonnet theorem. Differential forms and vector fields. Line and surface integrals. The divergence and Stoke's theorems.",3,"MA419","","MA201, MA222, MA205, and a 0.5 MA credit at the 300 level.","Hours per week:Lecture/Discussion: 3",TRUE,FALSE,FALSE,""
"47","MA422","Advanced Linear Algebra","Determinants; Cayley-Hamilton theorem; bilinear forms; adjoint, self-adjoint, and normal linear operators; the spectral theorem for normal operators; orthogonal and Hermitian operators; the Jordan canonical form of matrices and linear operators.",3,"MA322.","","MA222.","Hours per week:Lecture/Discussion: 3",TRUE,FALSE,FALSE,""
"48","MA425","Group Theory","Monoids and groups, subgroups, quotient groups and group homomorphisms: groups acting on sets, conjugacy and the class equation; the Sylow theorems; free groups; finitely generated Abelian groups.",3,"MA325.","","MA222, MA323.","Hours per week:Lecture/Discussion: 3",TRUE,FALSE,FALSE,""
"49","MA450","Measure and Integration","Sigma-algebras of sets; set functions; outer measures, measurable sets and Lebesgue measure; Riemann and Lebesgue integrals; convergence in measure.",3,"","","MA104 or MA200, MA215, and MA350.","Hours per week:Lecture/Discussion: 3",TRUE,FALSE,FALSE,""
"50","MA451","Introduction to Stochastic Calculus","Conditional expectations, sigma-algebras, and filtrations; martingales and stopping times; the Riemann-Stieltjesintegral; Gaussian processes and Brownian motion; stochastic integration and Ito's formula; diffusion processes and stochastic differential equations; the Feynman-Kac theorem.",3,"MA351.","","MA250 and ST359.","Hours per week:Lecture/Discussion: 3",TRUE,FALSE,FALSE,""
"51","MA464","Mathematical Biology","An introduction to the use of dynamical systems for the purpose of studying biological systems, with an emphasis on deterministic models. Models will be chosen from ecology and epidemology. Attention will be devoted to both the construction and the analysis of the models. Mathematical analysis will involve linear algebra, differential equations, and techniques from stability theory.",3,"MA365","","MA222 and MA305","Hours per week:Lecture/Discussion: 3",TRUE,FALSE,FALSE,""
"52","MA465","General Topology","Metric spaces and topological spaces; continuity and homeomorphisms; separation properties; countability properties; compactness; connectedness and path-connectedness; product spaces and quotient spaces; the fundamental group and covering spaces. ",3,"","","MA215 and MA250.","",FALSE,FALSE,FALSE,""
"53","MA470","Financial Mathematics III","Continuous-time financial models and riskless asset pricing. The Black-Scholes theory (including the Black-Scholes PDE). Arbitrage free pricing of European, American, and exotic options. Optional topics: stochastic volatility and jump-diffusion models; continuous-time interest rate models; pricing bonds and derivatives on interest rates.",3,"","","MA370, MA451.","Hours per week:Lecture/Discussion: 3",TRUE,FALSE,FALSE,""
"54","MA471","Computational Methods in Finance","Numerical methods used in financial engineering and risk management, including numerical solutions of ordinarily differential equations, finite difference methods, numerical optimization, Monte Carlo and quasi-Monte Carlo methods, numerical solutions of stochastic differential equations, fast Fourier and other discrete transform methods. The computational methods are illustrated with the use of programming languages such as MAPLE, MATLAB and VBA.",3,"","","MA205; MA370; and either MA307 or MA371","Hours per week:Lecture/Discussion: 3Lab: 2 (biweekly)",TRUE,TRUE,FALSE,""
