"","Course Code","Course Name","Course Description","Credit Amount","Antirequisite","Corequisite","Prerequisite","Hours","Lecture","Lab","Tutorial","Note"
"55","MA475","Ring and Field Theory","Rings; subrings, quotient rings and ring homomorphisms; ideal theory; polynomial rings; integral domains and divisor theory; fields and field extensions; the Fundamental Theorem of Galois Theory.",3,"","","MA222, MA323.","",FALSE,FALSE,FALSE,""
"56","MA477","Quantitative Financial Risk Management","This course will introduce students to a variety of topics in risk management. The defining feature of this course is that it will cover topics that are not typically covered in the traditional mathematical finance curriculum. As such it will be an important differentiator for the program. Topics might include (but will not necessarily be limited to) some of the following:",3,"","","MA270, MA307 or MA371, ST260.","Hours per week:Lecture/Discussion: 3",TRUE,FALSE,FALSE,""
"57","MA480","Directed Research","A detailed study of a topic under faculty supervision including the submission of a formal report.",6,"","","Permission of the department.","",FALSE,FALSE,FALSE,"Irregular course"
"58","MA485","Directed Studies","",3,"","","Permission of the department.†","",FALSE,FALSE,FALSE,"Irregular course"
"59","MA487","Mathematical Modelling in the Applied Sciences and Finance","An introduction to modelling tools used in modern applications of mathematics, including: dimensional analysis and scaling; discrete and continuous models; finite and infinite dimensional systems; variational modeling. Other topics may include: Financial bubbles. Interbank networks. Diffusion. Chemical kinetics. Stochastic models. Population models. Basic continuum mechanics.",3,"","","MA205, MA307 or MA371 or CP315/PC315.","",FALSE,FALSE,FALSE,""
"60","MA489","Honours Seminar","Completion of an appropriate individual project under faculty supervision, including submission of a final report and presentation in a department seminar. (Consult department for details.)",3,"","","Permission of the department.","",FALSE,FALSE,FALSE,""
"61","MA495","Special Topics","",3,"","","Permission of the department.††","",FALSE,FALSE,FALSE,"Irregular course"
"62","ST230","Introduction to Probability and Statistics for Science","Data collection and description including univariate and bivariate frequency tables, histograms and summary statistics; elementary probability theory; random variables and expectations; sampling theory and the Central Limit Theorem; estimation and hypothesis testing for data from one and two normal populations.",3,"MA240, MA241, BU205, BU255, EC205, EC255, EC285, ST231; prior credit for ST260, current enrolment in ST260.","","One of: MA101, MA103, or MA110","Hours per week:Lecture/Discussion: 3Lab: 1.5 (biweekly)",TRUE,TRUE,FALSE,"This course may not count for credit in Honours Mathematics, Financial Mathematics, or Data Science programs."
"63","ST231","Statistical Methods for Life and Health Sciences","This course covers all basic statistical concepts, and includes relevant examples for life and health science students. The course introduces descriptive and inferential statistics; basic probability theory; discrete and continuous random variables with focus on binomial and normal random variables; statistical inference for population means and population proportions, both for one and two populations, with focus on confidence intervals and tests of hypotheses. Furthermore, simple and multiple linear regression methods are covered as well as one-way and two-way ANOVA. Problems are analyzed with the aid of appropriate software.",3,"BU205, BU255, EC205, EC255, EC285, MA141, MA240, MA241, PS296, ST230; prior credit for ST260; current enrolment in ST260.","","One of: MA100, MA101, MA102, MA103, MA110.","Hours per week:Lecture/Discussion: 3Lab: 1.5 (biweekly)",TRUE,TRUE,FALSE,"This course may not count for credit in Honours Mathematics, Financial Mathematics, or Data Science programs."
"64","ST259","Probability I","Elementary probability theory; conditional probability and independence; discrete and continuous random variables; expected value, variance, covariance and correlation; introduction to Moment Generating Functions, the Law of Large Numbers and the Central Limit Theorem.",3,"MA240.","","MA104, or (one of MA101, MA103, MA110, and either MA121 or MA122).","Hours per week:Lecture/Discussion: 3Lab: 1.5 (biweekly)",TRUE,TRUE,FALSE,""
"65","ST260","Introduction to Statistics","Numerical and visual exploratory data analysis; probability models; point and interval estimation; bias and mean squared error of estimators; single-sample, paired and two- sample inference and hypothesis testing; introduction to experimental design and analysis of variance; introduction to goodness of fit and categorical data analysis; a thorough development of the simple linear regression model.",3,"MA240, MA241, BU205, BU255, EC205, EC255, EC285, [Note: Students holding credit in statistical quantitative methods courses other than those listed above are strongly advised to consult with their home departments before registering in ST260.]","","ST259.","Hours per week:Lecture/Discussion: 3Lab: 1.5 (biweekly)",TRUE,TRUE,FALSE,"NA"
"66","ST344","Introduction to Experimental Design and Survey Sampling","This course provides an introduction to two related areas of statistics -- experimental design and survey sampling. Topics covered in experimental design include randomization and replication; completely randomized and randomized complete block experiments; designs and analysis of variance (ANOVA) tables for fixed, random and mixed effects models; and efficiency of designs. The survey sampling part of the course provides a basic understanding of sample surveys and emphasizes the statistical aspects of taking and analyzing survey samples. Topics include: common sampling methods such as simple random, cluster and stratified sampling; sampling with unequal probabilities, sampling weights; complex surveys and its application to statistical modelling.",3,"MA344.","","ST260 or (ST259 and one of ST230, ST231).","Hours per week:Lecture/Discussion: 3",TRUE,FALSE,FALSE,""
"67","ST358","Applied Probability","Multivariate and conditional probability distributions; multivariate normal distribution; construction of multivariate distributions using copulas; Poisson processes; discrete-time Markov chains.",3,"","","ST259 and one of MA200, MA201.","Hours per week:Lecture/Discussion: 3",TRUE,FALSE,FALSE,""
"68","ST359","Probability II","Formal probability spaces and random variables; multivariate and conditional distributions; functions of jointly distributed random variables; mathematical expectation; conditioning; moment generating function and other transforms; functions of random variables; modes of convergence and limit theorems; introduction to topics in applied probability.",3,"MA340.","","MA200 or MA201, ST259.","Hours per week:Lecture/Discussion: 3Tutorial/Seminar: 1.5 (biweekly)",TRUE,FALSE,TRUE,""
"69","ST361","Mathematical Statistics","Parametric statistics; principles of data reduction including sufficiency and likelihood function; point estimation including methods of finding estimators and properties of estimators; interval estimation; hypothesis testing including likelihood ratio testing; introduction to Bayesian analysis.",3,"MA341.","","MA200 or MA201, ST260 or (ST259 and one of ST230, ST231).","Hours per week:Lecture/Discussion: 3",TRUE,FALSE,FALSE,""
"70","ST362","Regression Analysis","",3,"MA242","","MA122, ST260 or (ST259 and one of ST230, ST231).","Hours per week:Lecture/Discussion: 3Lab: 1.5 (biweekly)",TRUE,TRUE,FALSE,""
"71","ST462","Advanced Regression Analysis","This course provides a broad overview of modern statistical methods for regression analysis. Statistical methodology may include generalized linear models, generalized additive models, multilevel modelling, nonparametric methods and an introduction to survival analysis.",3,"MA348.","","ST362 or equivalent courses from other departments.","Hours per week:Lecture/Discussion: 3Lab: 1.5 (biweekly)",TRUE,TRUE,FALSE,""
"72","ST463","Computational Statistics","This course covers the implementation of a variety of computationally intensive statistical techniques. These include generation of random variables, vectors and processes; randomization methods; bootstrap methods; Markov chain Monte Carlo (MCMC) methods; numerical optimization in statistical inference [expectation-maximization (EM) algorithm, Fisher scoring, etc.].",3,"","","ST361, ST362; MA307 or MA371 is recommended.","Hours per week:Lecture/Discussion: 3Lab: 1.5 (biweekly)",TRUE,TRUE,FALSE,""
"73","ST473","Financial Data Analysis","",3,"","","MA270, MA307 or MA371, ST362.","Hours per week:Lecture/Discussion: 3",TRUE,FALSE,FALSE,""
"74","ST474","Monte Carlo Methods","",3,"MA495H.","","CP104 or MA207; MA200 or MA201; ST260 or (ST259 and one of ST230, ST231); and a 0.5 MA/ST credit at the 300 level (MA307 is recommended).","Hours per week:Lecture/Discussion: 3Lab: 1.5 (biweekly)",TRUE,TRUE,FALSE,""
"75","ST490","Stochastic Processes","Classification of stochastic processes; Markov Chains in discrete and continuous time including Poisson processes and birth-death processes; renewal theory; introduction to queuing theory.",3,"MA490.","","ST359.","Hours per week:Lecture/Discussion: 3",TRUE,FALSE,FALSE,""
"76","ST491","Survival Analysis","This course is designed to provide students with an understanding of the concepts, theoretical basis and statistical methods associated with survival data. Topics include censoring and truncation, Kaplan-Meier estimators, log-rank statistics, parametric models, proportional hazards models, competing risks and recurrent events. Models and techniques will be illustrated using examples from a variety of fields including medical and clinical research, insurance, and finance.",3,"","","ST362.","Hours per week:Lecture/Discussion: 3Lab: 1.5 (biweekly)",TRUE,TRUE,FALSE,""
"77","ST492","Time Series Analysis","(Cross-listed as EC455.)",3,"","","","",FALSE,FALSE,FALSE,""
"78","ST494","Statistical Learning","The course covers the most current techniques used in statistical learning and data analysis, and their background theoretical results. Two basic groups of methods are covered in this course: supervised learning (classification and regression) and unsupervised learning (clustering). The supervised learning methods include Recursive Partitioning Tree, Random Forest, Linear Discriminant and Quadratic Discriminant Analysis, Neural Network, Support Vector Machine, K-nearest neighbour, and Regression. The unsupervised learning methods include Hierarchical Clustering, K-means, and Model-based Clustering methods. Furthermore, the course also covers dimension reduction techniques such as LASSO and Ridge Regression, and model checking criteria. Some data visualization methods will be introduced in this course as well.",3,"","","ST362.","Hours per week:Lecture/Discussion: 3Lab: 1.5 (biweekly)",TRUE,TRUE,FALSE,""
