"","Course Code","Course Name","Course Description","Credit Amount","Antirequisite","Corequisite","Prerequisite","Recommended Preperation","Hours","Lecture","Lab","Seminar","Tutorial","Breadth Requirement","Distribution Requirement","Delivery Format","Note"
"1","MAT133Y1","Calculus and Linear Algebra for Commerce","Mathematics of finance. Matrices and linear equations. Review of differential calculus; applications. Integration and fundamental theorem; applications. Introduction to partial differentiation; applications. Course material expects at minimum high school calculus has been completed prior to undertaking course. This course will be useful for students interested in learning applied calculus in relation to future studies in commerce and/or social science programs. ",6,"MAT133Y5 or ( MATA32H3, MATA33H3)","","High school level calculus","","72L",TRUE,FALSE,FALSE,FALSE,"The Physical and Mathematical Universes (5)","Science","In Class",""
"2","MAT135H1","Calculus I","In this first introduction to Calculus, students will be introduced to the tools of differential calculus, the branch of calculus that is motivated by the problem of measuring how quantities change. Students will use these tools to solve other problems, including simplifying functions with straight lines, describing how different types of change are related, and computing maximum and minimum quantities. This course will focus on developing a deep understanding of why the tools of calculus make sense and how to apply them to the social, biological, and physical sciences. It will also emphasize translating between algebraic, graphical, numerical and verbal descriptions of each concept studied. This course will be useful for students interested in learning applied calculus in relation to future studies in economics, life science, and physical and mathematical science programs. ",3,"MAT135H5 or MAT136H5 or MAT135Y5 or MATA30H3 or MATA31H3 or MATA36H3 or APS162H1 or APS163H1 or ESC194H1 or ESC195H1 or MAT186H1 or MAT187H1 or MAT196H1 or MAT197H1","","High school level calculus","","36L/12T",TRUE,FALSE,FALSE,TRUE,"The Physical and Mathematical Universes (5)","Science","In Class",""
"3","MAT136H1","Calculus II","This second part of the introductory Calculus sequence focuses on integral calculus beginning with the Fundamental Theorem of Calculus, the connection between two seemingly unrelated problems: measuring changing quantities and finding areas of curved shapes. Students will develop a deep understanding of the integral, and use it to: unpack equations involving derivatives; to make sense of infinite sums; to write complicated functions as 'infinite polynomials'; and to compute areas, volumes, and totals in applied problems. This course will further develop students' abilities to translate between algebraic, graphical, numerical, and verbal descriptions of mathematics in a variety of applied contexts. This course is a continuation of MAT135H1 and will be useful for students interested in learning applied calculus in relation to future studies in economics, life science, and physical and mathematical science programs. ",3,"MAT136H5 or MAT135Y5 or MATA36H3 or APS163H1 or ESC195H1 or MAT187H1 or MAT197H1","","MAT135H1 or MAT135H5 or MATA30H3 or MATA31H3 or APS162H1 or ESC194H1 or MAT186H1 or MAT196H1","","36L/12T",TRUE,FALSE,FALSE,TRUE,"The Physical and Mathematical Universes (5)","Science","In Class",""
"4","MAT137Y1","Calculus with Proofs","A conceptual approach for students interest in theoretical foundations of mathematics. Attention is given to computational aspects as well as problem-solving techniques. Limits and continuity, mean value theorem, elementary transcendental functions including trigonometric functions, inverse function theorem, differentiation, integration, fundamental theorem of calculus, Taylor's theorem, sequences and series, power series, and applications. This course will be useful for students interested in learning theoretical calculus and proofs in relation to future studies in computer science, economics, mathematics, physics, and statistics. ",6,"MAT137Y5 or ( MATA30H3 or MATA31H3, MATA37H3)","","High school level calculus","","72L/24T",TRUE,FALSE,FALSE,TRUE,"The Physical and Mathematical Universes (5)","Science","In Class",""
"5","MAT138H1","Introduction to Proofs","The goal of this course is for students to become comfortable with abstraction, rigour, logic, and proofs. They will practice reading and understanding mathematical statements, analyzing definitions and properties, formulating conjectures and generalizations, providing and writing reasonable and precise arguments, writing and critiquing proofs. The instructor may use specific mathematical content, which could vary from year to year, to practice these skills. Students who take MAT135H1 and MAT136H1 and wish to take MAT237Y1 are required to take MAT138H1 prior to undertaking MAT237Y1. Students who are taking MAT137Y1 or MAT157Y1 and/or MAT240H1 and are interested in more preparation with logical arguments are encouraged to take MAT138H1 concurrently. ",3,"MAT137Y1 or MAT137Y5 or ( MATA30H3 or MATA31H3, MATA37H3) or MAT157Y1 or MAT157Y5","","High school level calculus","","36L/12T",TRUE,FALSE,FALSE,TRUE,"The Physical and Mathematical Universes (5)","Science","In Class",""
"6","MAT157Y1","Analysis I","A theoretical course in calculus; emphasizing proofs and techniques. Elementary logic, limits and continuity, least upper bounds, intermediate and extreme value theorems. Derivatives, mean value and inverse function theorems. Integrals, fundamental theorem, elementary transcendental functions. Techniques of integration. Taylor's theorem; sequences and series; uniform convergence and power series. This course is required for the Mathematics Specialist, the Applied Mathematics Specialist, the Mathematics and Physics Specialist, and the Mathematics and Philosophy Specialist program and provides a strong theoretical mathematics background. ",6,"MAT157Y5","","High school level calculus","Preparing for University Math (PUMP) Level II. Students may also want to take MAT138H1 concurrently with MAT157Y1.","72L/48T",TRUE,FALSE,FALSE,TRUE,"The Physical and Mathematical Universes (5)","Science","In Class",""
"7","MAT193H1","Women’s Mathematics","Mathematics has been shaped in significant ways by the work of outstanding female mathematicians such as Hypatia, Emmy Noether, Sofia Kovalevskaya, and Maryam Mirzakhani. Despite these successes, women still experience barriers to entering the field and participating at the highest levels. This course will blend an exploration of mathematics created by women with a study of the issue of women in mathematics. Students will have the opportunity to examine the complex factors that impact women’s participation in STEM, learn about the lives of female mathematicians, create their own mathematics, and sharpen their spatial cognition and logical thinking skills. Restricted to first-year students. Not eligible for CR/NCR option. ",3,"Not intended for students in a Mathematics Specialist or Major program.","","High school level algebra.","","36S",FALSE,FALSE,TRUE,FALSE,"The Physical and Mathematical Universes (5)","Science","In Class",""
"8","MAT198H1","Cryptology: The Mathematics of Secrecy and Security","How do we send our own confidential information through secure channels, and how can we break codes to uncover the secret information of our adversaries? The mathematical field of cryptology is dedicated to answering such questions. In this course we will study breakthroughs in cryptology, from secret messages in the ancient world and the Enigma cipher in World War II, to modern cryptosystems that facilitate online commerce. Along the way, you will develop a sophisticated understanding of how numbers interact and develop the ability to communicate messages secretly and mathematics clearly. Restricted to first-year students. Not eligible for CR/NCR option. ",3,"Not intended for students in a Mathematics Specialist or Major program.","","High school level algebra.","","24S",FALSE,FALSE,TRUE,FALSE,"The Physical and Mathematical Universes (5)","Science","In Class",""
"9","MAT199H1","Aha! Mathematical Discovery and Creative Problem Solving","This course is an exploration into the creative process and use of imagination as they arise in the context of mathematical problem solving. The problems, which are all at a pre-calculus level, are chosen primarily by the criterion of aesthetic appeal, and emphasize reasoning rather than technique. Still, many of them are quite challenging, and substantial independent thinking will be required, the course is therefore appropriate for students from a variety of backgrounds and disciplines, including hard sciences. Its goal will be to hone each participant's creativity and mathematical problem-solving skills while guiding them towards the `Aha!' experience which accompanies independent discovery. Restricted to first-year students. Not eligible for CR/NCR option. ",3,"","","High school level algebra","","36S",FALSE,FALSE,TRUE,FALSE,"The Physical and Mathematical Universes (5)","Science","In Class",""
"10","JUM202H1","Mathematics as an Interdisciplinary Pursuit","A study of the interaction of mathematics with other fields of inquiry: how mathematics influences, and is influenced by, the evolution of science and culture. Art, music, and literature, as well as the more traditionally related areas of the natural and social sciences may be considered. (Offered every three years) JUM202H1 is particularly suited as a Science Distribution Requirement course for Humanities and Social Science students. ",3,"JUM102H1","","","","24L/12T",TRUE,FALSE,FALSE,TRUE,"The Physical and Mathematical Universes (5)","Science","In Class",""
"11","JUM203H1","Mathematics as a Recreation","A study of games, puzzles and problems focusing on the deeper principles they illustrate. Concentration is on problems arising out of number theory and geometry, with emphasis on the process of mathematical reasoning. Technical requirements are kept to a minimum. A foundation is provided for a continuing lay interest in mathematics. (Offered every three years) JUM203H1 is particularly suited as a Science Distribution Requirement course for Humanities and Social Science students. ",3,"JUM103H1","","","","24L/12T",TRUE,FALSE,FALSE,TRUE,"The Physical and Mathematical Universes (5)","Science","In Class",""
"12","JUM205H1","Mathematical Personalities","An in-depth study of the life, times and work of several mathematicians who have been particularly influential. Examples may include Newton, Euler, Gauss, Kowalewski, Hilbert, Hardy, Ramanujan, Gödel, Erdös, Coxeter, Grothendieck. (Offered every three years) JUM205H1 is particularly suited as a Science Distribution Requirement course for Humanities and Social Science students. ",3,"JUM105H1","","","","24L/12T",TRUE,FALSE,FALSE,TRUE,"The Physical and Mathematical Universes (5)","Science","In Class",""
"13","MAT221H1","Applied Linear Algebra","An application-oriented approach to linear algebra, based on calculations in standard Euclidean space. Systems of linear equations, matrices, Gaussian elimination, subspaces, bases, orthogonal vectors and projections. Matrix inverses, kernel and range, rank-nullity theorem. Determinants, eigenvalues and eigenvectors, Cramer's rule, diagonalization. This course has strong emphasis on building computational skills in the area of algebra. Applications to curve fitting, economics, Markov chains and cryptography. ",3,"MAT223H1 or MAT223H5 or MATA22H3 or MATA23H3 or MAT224H1 or MAT224H5 or MATB24H3 or MAT240H1 or MAT240H5 or MAT185H1 or MAT188H1","","High school level calculus","","36L/12T",TRUE,FALSE,FALSE,TRUE,"The Physical and Mathematical Universes (5)","Science","In Class",""
"14","MAT223H1","Linear Algebra I","A first course on linear algebra in R^n emphasizing the interplay between algebraic and geometric perspectives. Topics include systems of equations, Gaussian elimination, representations of lines and planes, dot products, subspaces and translated subspaces, bases and change of basis, projections, the rank and nullity of a linear transformation, the rank/nullity/row space/column space of a matrix, matrix inverses, determinants, eigenvectors and eigenvalues, and matrix diagonalization. While not emphasizing proofs, this course does maintain a careful distinction between vectors and their representation in a basis as well as between matrices and linear transformations. ",3,"MAT223H5 or MATA22H3 or MATA23H3 or MAT224H1 or MAT224H5 or MATB24H3 or MAT240H1 or MAT240H5 or MAT247H1 or MAT247H5 or MAT185H1 or MAT188H1","","High school level calculus","","36L/12T",TRUE,FALSE,FALSE,TRUE,"The Physical and Mathematical Universes (5)","Science","In Class",""
"15","MAT224H1","Linear Algebra II","Fields, complex numbers, vector spaces over a field, linear transformations, matrix of a linear transformation, kernel, range, dimension theorem, isomorphisms, change of basis, eigenvalues, eigenvectors, diagonalizability, real and complex inner products, spectral theorem, adjoint/self-adjoint/normal linear operators, triangular form, nilpotent mappings, Jordan canonical form. ",3,"","","MAT221H1(80%) or MAT223H1 or MAT223H5 or MATA22H3 or MATA23H3 or MAT240H1 or MAT240H5","","36L/12T",TRUE,FALSE,FALSE,TRUE,"The Physical and Mathematical Universes (5)","Science","In Class",""
"16","MAT235Y1","Multivariable Calculus","Parametric equations and polar coordinates. Vectors, vector functions and space curves. Differential and integral calculus of functions of several variables. Line integrals and surface integrals and classic vector calculus theorems. Examples from life sciences and physical science applications. ",6,"MAT235Y5 or ( MAT232H5 or MAT233H5, MAT236H5 or MAT368H5) or ( MATB41H3, MATB42H3) or MAT237Y1 or MAT291H1 or MAT294H1","","MAT133Y1 or MAT133Y5 or ( MATA32H3, MATA33H3) or ( MAT135H1, MAT136H1) or ( MAT135H5, MAT136H5) or MAT134Y5 or MAT135Y5 or ( MATA30H3 or MATA31H3, MATA36H3 or MATA37H3) or MAT137Y1 or MAT137Y5 or MAT157Y1 or MAT157Y5","MAT223H1 or MAT223H5 or MATA22H3 or MATA23H3 or MAT240H1 or MAT240H5","72L",TRUE,FALSE,FALSE,FALSE,"The Physical and Mathematical Universes (5)","Science","In Class",""
"17","APM236H1","Applications of Linear Programming","Introduction to linear programming including a rapid review of linear algebra (row reduction, matrix inversion, linear independence), the simplex method with applications, the duality theorem, complementary slackness, the dual simplex method and the revised simplex method. ",3,"","","MAT221H1 or MAT223H1 or MAT223H5 or MATA22H3 or MATA23H3 or MAT240H1 or MAT240H5","","36L",TRUE,FALSE,FALSE,FALSE,"The Physical and Mathematical Universes (5)","Science","In Class",""
"18","MAT237Y1","Multivariable Calculus with Proofs","Elementary topology in Euclidean space. Differential calculus of vector valued functions of a vector variable. Implicit and inverse function theorems, regular surfaces. Optimization, Lagrange multipliers, multivariable Taylor polynomials. Integral calculus with the Jordan measure. Fubini’s theorem, change of variables. Line and surface integrals. Vector calculus in two- and three-dimensions. Green’s theorem, Divergence theorem, Stokes’ theorem. Fourier series. This course is recommended for students interested in proof-based multivariable calculus with balanced emphasis between theory and applications. ",6,"","","[( MAT135H1, MAT136H1) or ( MAT135H5, MAT136H5) or MAT134Y5 or MAT135Y5 or ( MATA30H3 or MATA31H3, MATA36H3), MAT138H1 or MAT102H5 or MAT246H1] or MAT137Y1 or MAT137Y5 or ( MATA30H3 or MATA31H3, MATA37H3) or MAT157Y1 or MAT157Y5, MAT223H1 or MATA22H3 or MATA23H3 or MAT240H1 or MAT240H5","","72L",TRUE,FALSE,FALSE,FALSE,"The Physical and Mathematical Universes (5)","Science","In Class",""
"19","MAT240H1","Algebra I","A theoretical approach to: vector spaces over arbitrary fields, including C and Z_p. Subspaces, bases and dimension. Linear transformations, matrices, change of basis, similarity, determinants. Polynomials over a field (including unique factorization, resultants). Eigenvalues, eigenvectors, characteristic polynomial, diagonalization. Minimal polynomial, Cayley-Hamilton theorem. ",3,"MAT240H5","MAT157Y1","High school level calculus","","36L/24T",TRUE,FALSE,FALSE,TRUE,"The Physical and Mathematical Universes (5)","Science","In Class",""
"20","MAT244H1","Introduction to Ordinary Differential Equations","First order ordinary differential equations: Direction fields, integrating factors, separable equations, homogeneous equations, exact equations, autonomous equations, modeling. Existence and uniqueness theorem. Higher order equations: Constant coefficient equations, reduction of order, Wronskian, method of undetermined coefficients, variation of parameters. Solutions by series and integrals. First order linear systems, fundamental matrices. Non-linear equations, phase plane, stability. Applications in life and physical sciences and economics. ",3,"MAT242H5 or MAT244H5 or MATB44H3 or MAT212H5 or MAT258Y5 or MAT292H1","MAT235Y1 or MAT237Y1 or MAT257Y1","( MAT135H1 or MAT135H5 or MATA35H3 or MATA30H3 or MATA31H3, MAT136H1 or MAT136H5 or MATA36H3 or MATA37H3) or MAT135Y5 or MAT137Y1 or MAT137Y5 or MAT157Y1 or MAT157Y5, MAT223H1 or MATA23H3 or MAT223H5 or MAT240H1 or MAT240H5","","36L",TRUE,FALSE,FALSE,FALSE,"The Physical and Mathematical Universes (5)","Science","In Class",""
"21","MAT245H1","Mathematical Methods in Data Science","An introduction to the mathematical methods behind scientific techniques developed for extracting information from large data sets. Elementary probability density functions, conditional expectation, inverse problems, regularization, dimension reduction, gradient methods, singular value decomposition and its applications, stability, diffusion maps. Examples from applications in data science and big data. ",3,"","MAT237Y1 or MAT257Y1","MAT137Y1 or MAT157Y1, MAT223H1 or MAT240H1, MAT224H1 or MAT247H1","","36L/24P",TRUE,TRUE,FALSE,FALSE,"The Physical and Mathematical Universes (5)","Science","In Class",""
"22","MAT246H1","Concepts in Abstract Mathematics","Designed to introduce students to mathematical proofs and abstract mathematical concepts. Topics may include modular arithmetic, sizes of infinite sets, and a proof that some angles cannot be trisected with straightedge and compass. ",3,"MAT157Y1 or MAT157Y5","","MAT133Y1 or MAT133Y5 or ( MATA32H3, MATA33H3) or ( MAT135H1, MAT136H1) or ( MAT135H5, MAT136H5) or MAT134Y5 or MAT135Y5 or ( MATA30H3 or MATA31H3, MATA36H3 or MATA37H3) or MAT137Y1 or MAT137Y5, MAT223H1 or MATA22H3 or MATA23H3 or MAT240H1 or MAT240H5","","36L/12T",TRUE,FALSE,FALSE,TRUE,"The Physical and Mathematical Universes (5)","Science","In Class",""
"23","MAT247H1","Algebra II","A theoretical approach to real and complex inner product spaces, isometries, orthogonal and unitary matrices and transformations. The adjoint. Hermitian and symmetric transformations. Spectral theorem for symmetric and normal transformations. Polar representation theorem. Primary decomposition theorem. Rational and Jordan canonical forms. Additional topics including dual spaces, quotient spaces, bilinear forms, quadratic surfaces, multilinear algebra. ",3,"MAT247H5","MAT157Y1","MAT240H1 or MAT240H5","","36L",TRUE,FALSE,FALSE,FALSE,"The Physical and Mathematical Universes (5)","Science","In Class",""
"24","MAT257Y1","Analysis II","Topology of R^n; compactness, functions and continuity, extreme value theorem. Derivatives; inverse and implicit function theorems, maxima and minima, Lagrange multipliers. Integration; Fubini's theorem, partitions of unity, change of variables. Differential forms. Manifolds in R^n; integration on manifolds; Stokes' theorem for differential forms and classical versions. Some topics may vary year-to-year. ",6,"","","MAT157Y1 or MAT157Y5, MAT247H1 or MAT247H5","","72L/48T",TRUE,FALSE,FALSE,TRUE,"The Physical and Mathematical Universes (5)","Science","In Class",""
"25","MAT267H1","Advanced Ordinary Differential Equations","A theoretical course on Ordinary Differential Equations. First-order equations: separable equations, exact equations, integrating factors. Variational problems, Euler-Lagrange equations. Linear equations and first-order systems. Fundamental matrices, Wronskians. Non-linear equations. Existence and uniqueness theorems. Method of power series. Elementary qualitative theory; stability, phase plane, stationary points. Oscillation theorem, Sturm comparison. Applications in mechanics, physics, chemistry, biology and economics. ",3,"MAT234H1 or MAT292H1","MAT257Y1","MAT157Y1 or MAT157Y5, MAT247H1 or MAT247H5","","36L/12T",TRUE,FALSE,FALSE,TRUE,"The Physical and Mathematical Universes (5)","Science","In Class",""
"26","MAT271H1","Insights from Mathematics","This breadth course is accessible to students with limited mathematical background. Various mathematical techniques will be illustrated with examples from humanities and social science disciplines. Some of the topics will incorporate user friendly computer explorations to give participants the feel of the subject without requiring skill at calculations.  ",3,"","","","","36L/6T",TRUE,FALSE,FALSE,TRUE,"The Physical and Mathematical Universes (5)","Science","In Class","This course cannot be used to satisfy requirements of program in the math department."
"27","MAT282H1","Topics in Mathematics","A course in mathematics on a topic outside the current undergraduate offerings. For information on the specific topic to be studied and possible additional prerequisites, go to http://www.math.toronto.edu/cms/current-students-ug/ ",3,"","","1.0 MAT credit at the 100-level. Possible additional topic-specific prerequisites.","","36L",TRUE,FALSE,FALSE,FALSE,"The Physical and Mathematical Universes (5)","Science","In Class",""
"28","MAT295H1","Independent Reading in Mathematics","Independent study under the direction of a faculty member. Topic must be outside undergraduate offerings. Similar workload to a 36L course. Not eligible for CR/NCR option. Completed applications for this course are due to the Math Undergraduate Program Office no later than the third day of the term that the reading course will start. ",3,"","","Minimum GPA of 3.5 in APM and MAT courses. Permission of the Associate Chair for Undergraduate Studies and of the prospective supervisor.","","",FALSE,FALSE,FALSE,FALSE,"The Physical and Mathematical Universes (5)","Science","In Class",""
"29","MAT296H1","Independent Reading in Mathematics","Independent study under the direction of a faculty member. Topic must be outside undergraduate offerings. Workload equivalent to a 36L course. Not eligible for CR/NCR option. ",3,"","","Minimum GPA of 3.5 in APM and MAT courses. Permission of the Associate Chair for Undergraduate Studies and of the prospective supervisor.","","",FALSE,FALSE,FALSE,FALSE,"The Physical and Mathematical Universes (5)","Science","In Class",""
"30","MAT297Y1","Research Project in Mathematics","Independent research under the direction of a faculty member. Similar workload to a 72L course. Not eligible for CR/NCR option. Completed applications for this course are due to the Math Undergraduate Program Office no later than the third day of the term that the reading course will start. ",6,"","","Minimum GPA of 3.5 in APM and MAT courses. Permission of the Associate Chair for Undergraduate Studies and of the prospective supervisor","","",FALSE,FALSE,FALSE,FALSE,"The Physical and Mathematical Universes (5)","Science","In Class",""
"31","MAT299Y1","Research Opportunity Program","Credit course for supervised participation in faculty research project. Details at https://www.artsci.utoronto.ca/current/academics/research-opportunities…. Not eligible for CR/NCR option. ",6,"","","","","",FALSE,FALSE,FALSE,FALSE,"","Science","In Class",""
"32","MAT301H1","Groups and Symmetries","Congruences and fields. Permutations and permutation groups. Linear groups. Abstract groups, homomorphisms, subgroups. Symmetry groups of regular polygons and Platonic solids, wallpaper groups. Group actions, class formula. Cosets, Lagrange theorem. Normal subgroups, quotient groups. Classification of finitely generated abelian groups. Emphasis on examples and calculations. ",3,"MAT347Y1","","MAT257Y1 or ( MAT224H1 or MAT247H1, MAT235Y1 or MAT237Y1, MAT246H1 or MAT157Y1 or CSC236H1 or CSC240H1) or (MAT185H1, MAT194H1, MAT195H1)","","36L",TRUE,FALSE,FALSE,FALSE,"The Physical and Mathematical Universes (5)","Science","In Class",""
"33","APM306Y1","Mathematics and Law","This course examines the relationship between legal reasoning and mathematical logic; provides a mathematical perspective on the legal treatment of interest and actuarial present value; critiques ethical issues; analyzes how search engine techniques on massive databases transform legal research and considers the impact of statistical analysis and game theory on litigation strategies. NOTE This course counts as 0.5 credit in BR=3 and 0.5 credit in BR=5. This course will only contribute 0.5 credit to the Math Minor program. ",6,"JUM206Y1","","( MAT135H1 or MAT135H5 or MAT136H1 or MAT136H5) or MAT137Y1 or MAT157Y1, MAT221H1 or MAT223H1 or MAT240H1","","72L",TRUE,FALSE,FALSE,FALSE,"The Physical and Mathematical Universes (5), Society and its Institutions (3)","Science","In Class",""
