"","Course Code","Course Name","Course Description","Credit Amount","Antirequisite","Corequisite","Prerequisite","Recommended Preperation","Hours","Lecture","Lab","Seminar","Tutorial","Breadth Requirement","Distribution Requirement","Delivery Format","Note"
"73","APM441H1","Asymptotic and Perturbation Methods","Asymptotic series. Asymptotic methods for integrals: stationary phase and steepest descent. Regular perturbations for algebraic and differential equations. Singular perturbation methods for ordinary differential equations: W.K.B., strained co-ordinates, matched asymptotics, multiple scales. (Emphasizes techniques; problems drawn from physics and engineering) ",3,"","","APM346H1 or MAT351Y1, MAT334H1 or MAT354H1","","36L",TRUE,FALSE,FALSE,FALSE,"The Physical and Mathematical Universes (5)","Science","In Class",""
"74","MAT445H1","Representation Theory","A selection of topics from: Representation theory of finite groups, topological groups and compact groups. Group algebras. Character theory and orthogonality relations. Weyl's character formula for compact semisimple Lie groups. Induced representations. Structure theory and representations of semisimple Lie algebras. Determination of the complex Lie algebras. Joint undergraduate/graduate - MAT445H1/MAT1196H ",3,"","","MAT347Y1","","36L",TRUE,FALSE,FALSE,FALSE,"The Physical and Mathematical Universes (5)","Science","In Class",""
"75","APM446H1","Applied Nonlinear Equations","Partial differential equations appearing in physics, material sciences, biology, geometry, and engineering. Nonlinear evolution equations. Existence and long-time behaviour of solutions. Existence of static, traveling wave, self-similar, topological and localized solutions. Stability. Formation of singularities and pattern formation. Fixed point theorems, spectral analysis, bifurcation theory. Equations considered in this course may include: Allen-Cahn equation (material science), Ginzburg-Landau equation (condensed matter physics), Cahn-Hilliard (material science, biology), nonlinear Schroedinger equation (quantum and plasma physics, water waves, etc). mean curvature flow (geometry, material sciences), Fisher-Kolmogorov-Petrovskii-Piskunov (combustion theory, biology), Keller-Segel equations (biology), and Chern-Simons equations (particle and condensed matter physics). Joint undergraduate/graduate course - APM446H1/MAT1508H ",3,"","","APM346H1 or MAT351Y1","","36L",TRUE,FALSE,FALSE,FALSE,"The Physical and Mathematical Universes (5)","Science","In Class",""
"76","MAT448H1","Introduction to Commutative Algebra and Algebraic Geometry","Basic notions of algebraic geometry, with emphasis on commutative algebra or geometry according to the interests of the instructor. Algebraic topics: localization, integral dependence and Hilbert's Nullstellensatz, valuation theory, power series rings and completion, dimension theory. Geometric topics: affine and projective varieties, dimension and intersection theory, curves and surfaces, varieties over the complex numbers. This course will be offered in alternating years. Joint undergraduate/graduate course - MAT448H1/MAT1155H ",3,"","","MAT347Y1","","36L",TRUE,FALSE,FALSE,FALSE,"The Physical and Mathematical Universes (5)","Science","In Class",""
"77","MAT449H1","Algebraic Curves","Projective geometry. Curves and Riemann surfaces. Algebraic methods. Intersection of curves; linear systems; Bezout's theorem. Cubics and elliptic curves. Riemann-Roch theorem. Newton polygon and Puiseux expansion; resolution of singularities. This course will be offered in alternating years. ",3,"","","MAT347Y1, MAT354H1","","36L",TRUE,FALSE,FALSE,FALSE,"The Physical and Mathematical Universes (5)","Science","In Class",""
"78","MAT454H1","Complex Analysis II","Harmonic functions, Harnack's principle, Poisson's integral formula and Dirichlet's problem. Infinite products and the gamma function. Normal families and the Riemann mapping theorem. Analytic continuation, monodromy theorem and elementary Riemann surfaces. Elliptic functions, the modular function and the little Picard theorem. Joint undergraduate/graduate course - MAT454H1/MAT1002H ",3,"","","MAT354H1","","36L",TRUE,FALSE,FALSE,FALSE,"The Physical and Mathematical Universes (5)","Science","In Class",""
"79","MAT457H1","Advanced Real Analysis I","Lebesgue measure and integration; convergence theorems, Fubini's theorem, Lebesgue differentiation theorem, abstract measures, Caratheodory theorem, Radon-Nikodym theorem. Hilbert spaces, orthonormal bases, Riesz representation theorem, compact operators, L^p spaces, Hölder and Minkowski inequalities. Joint undergraduate/graduate course - MAT457H1/MAT1000H ",3,"MAT457Y1","","MAT357H1","","36L",TRUE,FALSE,FALSE,FALSE,"The Physical and Mathematical Universes (5)","Science","In Class",""
"80","MAT458H1","Advanced Real Analysis II","Fourier series and transform, convergence results, Fourier inversion theorem, L^2 theory, estimates, convolutions. Banach spaces, duals, weak topology, weak compactness, Hahn-Banach theorem, open mapping theorem, uniform boundedness theorem. Joint undergraduate/graduate course - MAT458H1/MAT1001H ",3,"MAT457Y1","","MAT457H1","","36L",TRUE,FALSE,FALSE,FALSE,"The Physical and Mathematical Universes (5)","Science","In Class",""
"81","MAT461H1","Hamiltonian Mechanics","This course focuses on key notions of classical mechanics: Newton equations, variational principles, Lagrangian formulation and Euler-Lagrange equations, the motion in a central force, the motion of a rigid body, small oscillations, Hamiltonian formulation, canonical transformations, Hamilton-Jacobi theory, action-angle variables, and integrable systems. ",3,"","","MAT244H1 or MAT267H1, MAT337H1 or MAT367H1, APM346H1 or MAT351Y1","MAT267H1, MAT367H1","36L",TRUE,FALSE,FALSE,FALSE,"The Physical and Mathematical Universes (5)","Science","In Class",""
"82","APM461H1","Combinatorial Methods","A selection of topics from such areas as graph theory, combinatorial algorithms, enumeration, construction of combinatorial identities. Joint undergraduate/graduate course - APM461H1/MAT1302H ",3,"","","MAT224H1 or MAT247H1, MAT137Y1 or MAT157Y1, MAT301H1 or MAT347Y1","MAT344H1","36L",TRUE,FALSE,FALSE,FALSE,"The Physical and Mathematical Universes (5)","Science","In Class",""
"83","APM462H1","Nonlinear Optimization","An introduction to first and second order conditions for finite and infinite dimensional optimization problems with mention of available software. Topics include Lagrange multipliers, Kuhn-Tucker conditions, convexity and calculus of variations. Basic numerical search methods and software packages which implement them will be discussed. ",3,"","","( MAT223H1, MAT224H1) or MAT247H1, MAT235Y1 or MAT237Y1 or MAT257Y1","MAT336H1 or MAT337H1","36L",TRUE,FALSE,FALSE,FALSE,"The Physical and Mathematical Universes (5)","Science","In Class",""
"84","MAT464H1","Riemannian Geometry","Riemannian metrics. Levi-Civita connection. Geodesics. Exponential map. Second fundamental form. Complete manifolds and Hopf-Rinow theorem. Curvature tensors. Ricci curvature and scalar curvature. Spaces of constant curvature. Joint undergraduate/graduate course - MAT464H1/MAT1342H ",3,"","","MAT367H1","","36L",TRUE,FALSE,FALSE,FALSE,"The Physical and Mathematical Universes (5)","Science","In Class",""
"85","APM466H1","Mathematical Theory of Finance","Introduction to the basic mathematical techniques in pricing theory and risk management: Stochastic calculus, single-period finance, financial derivatives (tree-approximation and Black-Scholes model for equity derivatives, American derivatives, numerical methods, lattice models for interest-rate derivatives), value at risk, credit risk, portfolio theory. Joint undergraduate/graduate course - APM466H1/MAT1856H ",3,"","STA457H1","APM346H1, STA347H1","","36L",TRUE,FALSE,FALSE,FALSE,"The Physical and Mathematical Universes (5)","Science","In Class",""
"86","MAT475H1","Problem Solving Seminar","This course addresses the question: How do you attack a problem the likes of which you have never seen before? Students will apply Polya's principles of mathematical problem solving, draw upon their previous mathematical knowledge, and explore the creative side of mathematics in solving a variety of interesting problems and explaining those solutions to others. ",3,"","","MAT224H1 or MAT247H1, MAT235Y1 or MAT237Y1 or MAT257Y1, and at least 1.0 credit at the 300+ level in APM orMAT","","",FALSE,FALSE,FALSE,FALSE,"The Physical and Mathematical Universes (5)","Science","In Class",""
"87","MAT477H1","Seminar in Mathematics","Seminar in an advanced topic. Content will generally vary from semester to semester. Student presentations are required. ",3,"","","MAT347Y1, MAT354H1, MAT357H1","","",FALSE,FALSE,FALSE,FALSE,"The Physical and Mathematical Universes (5)","Science","In Class",""
"88","MAT478H1","Seminar in Mathematics","Seminar in an advanced topic. Content will generally vary from semester to semester. Student presentations are required. ",3,"","","MAT347Y1, MAT354H1, MAT357H1","","",FALSE,FALSE,FALSE,FALSE,"The Physical and Mathematical Universes (5)","Science","In Class",""
"89","MAT482H1","Topics in Mathematics","A course in mathematics on a topic outside the current undergraduate offerings. For information on the specific topic to be studied and possible additional prerequisites, go to http://www.math.toronto.edu/cms/current-students-ug/. Joint undergraduate/graduate course - MAT482H1/MAT1901H ",3,"","","6.0 APM orMAT credits at the 100, 200 and 300-level. Possible additional topic-specific prerequisites.","","36L",TRUE,FALSE,FALSE,FALSE,"The Physical and Mathematical Universes (5)","Science","In Class",""
"90","MAT483H1","Topics in Mathematics","A course in mathematics on a topic outside the current undergraduate offerings. For information on the specific topic to be studied and possible additional prerequisites, go to http://www.math.toronto.edu/cms/current-students-ug/. ",3,"","","6.0 APM orMAT credits at the 100, 200 and 300-level. Possible additional topic-specific prerequisites.","","36L",TRUE,FALSE,FALSE,FALSE,"The Physical and Mathematical Universes (5)","Science","In Class",""
"91","MAT495H1","Independent Reading in Mathematics","Independent study under the direction of a faculty member. Topic must be outside undergraduate offerings. Workload equivalent to a 36L course. Not eligible for CR/NCR option. Completed applications for this course are due to the Math Undergraduate Program Office no later than the third day of the term that the reading course will start. ",3,"","","Minimum GPA of 3.5 in APM and MAT courses. Permission of the Associate Chair for Undergraduate Studies and of the prospective supervisor","","",FALSE,FALSE,FALSE,FALSE,"The Physical and Mathematical Universes (5)","Science","In Class",""
"92","APM496H1","Independent Readings in Applied Mathematics","Independent study under the direction of a faculty member. Topic must be outside current undergraduate offerings. Similar workload to a course that has 36 lecture hours. Not eligible for CR/NCR option. Completed applications for this course are due to the Math Undergraduate Program Office no later than the third day of the term that the reading course will start. ",3,"","","minimum GPA 3.5 for APM and MAT courses. Permission of the Associate Chair for Undergraduate Studies and of the prospective supervisor","","",FALSE,FALSE,FALSE,FALSE,"The Physical and Mathematical Universes (5)","Science","In Class",""
"93","MAT496H1","Independent Reading in Mathematics","Independent study under the direction of a faculty member. Topic must be outside undergraduate offerings. Workload equivalent to a 36L course. Not eligible for CR/NCR option. Completed applications for this course are due to the Math Undergraduate Program Office no later than the third day of the term that the reading course will start. ",3,"","","Minimum GPA of 3.5 in APM and MAT courses. Permission of the Associate Chair for Undergraduate Studies and of the prospective supervisor.","","",FALSE,FALSE,FALSE,FALSE,"The Physical and Mathematical Universes (5)","Science","In Class",""
"94","MAT497Y1","Research Project in Mathematics","Independent research under the direction of a faculty member. Not eligible for CR/NCR option. Similar workload to a 72L course. Completed applications for this course are due to the Math Undergraduate Program Office no later than the third day of the term that the reading course will start. ",6,"","","Minimum GPA of 3.5 in APM and MAT courses. Permission of the Associate Chair for Undergraduate Studies and of the prospective supervisor","","",FALSE,FALSE,FALSE,FALSE,"The Physical and Mathematical Universes (5)","Science","In Class",""
"95","MAT499Y1","Readings in Mathematics","Independent study under the direction of a faculty member. Topic must be outside undergraduate offerings. Workload equivalent to a 72L course. Not eligible for CR/NCR option. Completed applications for this course are due to the Math Undergraduate Program Office no later than the third day of the term that the reading course will start. ",6,"","","Minimum GPA of 3.5 in APM and MAT courses. Permission of the Associate Chair for Undergraduate Studies and of the prospective supervisor.","","",FALSE,FALSE,FALSE,FALSE,"The Physical and Mathematical Universes (5)","Science","In Class",""
