"","Course Code","Course Name","Course Description","Credit Amount","Antirequisite","Corequisite","Prerequisite","Breadth Category","Quantitative Requirement","Writing Requirement"
"45","CMPT 403","System Security and Privacy","Starting from cybersecurity principles, students will learn to protect systems from attacks on data confidentiality, integrity, system availability, and user privacy. By modeling system security, students will learn to find weaknesses in software, hardware, networks, data storage systems, and the Internet, and identify current security practices to protect these systems.",3,"","","Prerequisite: CMPT 300 with a minimum grade of C-.","",FALSE,FALSE
"46","CMPT 404","Cryptography and Cryptographic Protocols","The main cryptographic tools and primitives, their use in cryptographic applications; security and weaknesses of the current protocols. The notion of security, standard encryption schemes, digital signatures, zero-knowledge, selected other topics. CMPT 307 and 308 are recommended.",3,"","","Prerequisite: (MACM 201 or CMPT 210) with a minimum grade of C-.","",FALSE,FALSE
"47","CMPT 405","Design and Analysis of Computing Algorithms","Models of computation, methods of algorithm design; complexity of algorithms; algorithms on graphs, NP-completeness, approximation algorithms, selected topics.",3,"","","Prerequisite: CMPT 307 with a minimum grade of C-.","",FALSE,FALSE
"48","CMPT 406","Computational Geometry","Mathematical preliminaries; convex hull algorithms; intersection problems; closest-point problems and their applications.",3,"","","Prerequisite: CMPT 307 with a minimum grade of C-.","",FALSE,FALSE
"49","CMPT 407","Computational Complexity","Study of what is, and is not, efficiently computable with limited resources (time, space, randomness, parallelism, nondeterminism, interaction, and quantum). Complexity classes and connections among them. Interplay between complexity and algorithm design. CMPT 308 is recommended.",3,"","","Prerequisite: CMPT 307 with a minimum grade of C-.","",FALSE,FALSE
"50","CMPT 409","Special Topics in Theoretical Computing Science","Current topics in theoretical computing science depending on faculty and student interest.",3,"","","Prerequisite: CMPT 307 with a minimum grade of C-.","",FALSE,FALSE
"51","CMPT 410","Machine Learning","Machine Learning (ML) is the study of computer algorithms that improve automatically through experience. This course introduces students to the theory and practice of machine learning, and covers mathematical foundations, models such as (generalized) linear models, kernel methods and neural networks, loss functions for classification and regression, and optimization methods.",3,"Students with credit for CMPT 419 under the title ""Machine Learning"" may not take this course for further credit.","","Prerequisite: CMPT 310 and MACM 316, both with a minimum grade of C-.","",FALSE,FALSE
"52","CMPT 411","Knowledge Representation","Formal and foundational issues dealing with the representation of knowledge in artificial intelligence systems are covered. Questions of semantics, incompleteness, non-monotonicity and others will be examined. As well, particular approaches, such as procedural or semantic network, may be discussed.",3,"","","Prerequisite: Completion of nine units in Computing Science upper division courses or, in exceptional cases, permission of the instructor.","",FALSE,FALSE
"53","CMPT 412","Computational Vision","Computational approaches to image understanding will be discussed in relation to theories about the operation of the human visual system and with respect to practical applications in robotics. Topics will include edge detection, shape from shading, stereopsis, optical flow, Fourier methods, gradient space, three-dimensional object representation and constraint satisfaction.",3,"","","Prerequisite: MATH 152 with a minimum grade of C-, and nine units in Computing upper division courses or permission of the instructor.","",FALSE,FALSE
"54","CMPT 413","Computational Linguistics","This course examines the theoretical and applied problems of constructing and modelling systems, which aim to extract and represent the meaning of natural language sentences or of whole discourses, but drawing on contributions from the fields of linguistics, cognitive psychology, artificial intelligence and computing science.",3,"","","Prerequisite: Completion of nine units in Computing Science upper division courses or, in exceptional cases, permission of the instructor.","",FALSE,FALSE
"55","CMPT 414","Model-Based Computer Vision","This course covers various topics in computer vision with the emphasis on the model-based approach. Main subjects include 2-D and 3-D representations, matching, constraint relaxation, model-based vision systems. State-of-the-art robot vision systems will be used extensively as study cases. The solid modelling and CAD aspects of this course should also interest students of computer graphics.",3,"","","Prerequisite: MATH 152 with a minimum grade of C- and nine units in CMPT upper division courses, or permission of the instructor.","",FALSE,FALSE
"56","CMPT 415","Special Research Projects","To be individually arranged.",3,"","","Prerequisite: Permission of Instructor and School.","",FALSE,FALSE
"57","CMPT 416","Special Research Projects","To be individually arranged.",3,"","","Prerequisite: Permission of the department.","",FALSE,FALSE
"58","CMPT 417","Intelligent Systems","Intelligent Systems using modern constraint programming and heuristic search methods. A survey of this rapidly advancing technology as applied to scheduling, planning, design and configuration. An introduction to constraint programming, heuristic search, constructive (backtrack) search, iterative improvement (local) search, mixed-initiative systems and combinatorial optimization.",3,"","","Prerequisite: CMPT 225 with a minimum grade of C-.","",FALSE,FALSE
"59","CMPT 419","Special Topics in Artificial Intelligence","Current topics in artificial intelligence depending on faculty and student interest.",3,"","","","",FALSE,FALSE
"60","CMPT 420","Deep Learning","In machine learning, many recent successes have been achieved using neural networks with several layers, so-called deep neural networks. Convolutional neural nets, autoencoders, recurrent neural nets, long-short term memory networks, and generative adversarial networks will be presented. Students will look at techniques for training them from data, and applications.",3,"Students with credit for CMPT 728 may not take this course for further credit.","","Prerequisite: CMPT 410 or CMPT 419 (Machine Learning), with a minimum grade of C-.","",FALSE,FALSE
"61","CMPT 426","Practicum I","First term of work experience in the School of Computing Science Co-operative Education Program. Units from this course do not count towards the units required for an SFU degree. Graded as pass/fail (P/F). sfu.ca/coop/bol for further details) at least two terms before their anticipated co-op placement. Students must then enroll with the co-op program by the second week of the term preceding the work term. Normally, students will have completed a minimum of 45 units by the end of the term of application, CMPT 275 or 276, and have a minimum CGPA of 2.50.",3,"","","Prerequisite: Students must complete Bridging Online (visit www.","",FALSE,FALSE
"62","CMPT 427","Practicum II","The second term of work experience for students in the Computing Science Co-operative Education Program. Units from this course do not count towards the units required for an SFU degree. Graded as pass/fail (P/F). 50.",3,"","","Prerequisite: CMPT 426, CGPA of 2.","",FALSE,FALSE
"63","CMPT 428","Practicum III","The third term of work experience for students in the Computing Science Co-operative Education Program. Units from this course do not count towards the units required for an SFU degree. Graded as pass/fail (P/F). 50.",3,"","","Prerequisite: CMPT 427, CGPA of 2.","",FALSE,FALSE
"64","CMPT 429","Practicum IV","The fourth term of work experience for students in the Computing Science Co-operative Education Program. Units from this course do not count towards the units required for an SFU degree. Graded as pass/fail (P/F). 50.",3,"","","Prerequisite: CMPT 428, CGPA of 2.","",FALSE,FALSE
"65","CMPT 430","Practicum V","An optional fifth term of work experience for students in the Computing Science Co-operative Education Program. Units from this course do not count towards the units required for an SFU degree. This course may be repeated for credit at most twice. Repeating for credit requires approval of the School. Graded as pass/fail (P/F). 50.",3,"","","Prerequisite: CMPT 429, CGPA of 2.","",FALSE,FALSE
"66","CMPT 431","Distributed Systems","An introduction to distributed systems: systems consisting of multiple physical components connected over a network. Architectures of such systems, ranging from client-server to peer-to-peer. Distributed systems are analyzed via case studies of real network file systems, replicated systems, sensor networks and peer-to-peer systems. Hands-on experience designing and implementing a complex distributed system.",3,"Students with credit for CMPT 401 before September 2008 may not take this course for further credit.","","Prerequisite: CMPT 300, 371, both with a minimum grade of C-.","",FALSE,FALSE
"67","CMPT 433","Embedded Systems","The basics of embedded system organization, hardware-software co-design, and programmable chip technologies are studied. Formal models and specification languages for capturing and analyzing the behavior of embedded systems. The design and use of tools for system partitioning and hardware/software co-design implementation, validation, and verification are also studied.",3,"","","Prerequisite: CMPT 295 and CMPT 300, with a minimum grade of C-.","",FALSE,FALSE
"68","CMPT 441","Computational Biology","This course introduces students to the computing science principles underlying computational biology. The emphasis is on the design, analysis and implementation of computational techniques. Possible topics include algorithms for sequence alignment, database searching, gene finding, phylogeny and structure analysis.",3,"Students with credit for CMPT 341 may not take this course for further credit.","","Prerequisite: CMPT 307 with a minimum grade of C-.","",FALSE,FALSE
"69","CMPT 450","Computer Architecture","Principles of the architecture of computing systems. Topics include: superscalar processor micro-architecture, speculative execution, cache and memory hierarchy, multiprocessors, cache coherence, memory consistency, implications of technology on architecture, parallel architectures (multi-threading, GPUs, vector processors).",3,"","","Prerequisite: CMPT 295 with a minimum grade of C-.","",FALSE,FALSE
"70","CMPT 454","Database Systems II","An advanced course on database systems which covers crash recovery, concurrency control, transaction processing, distributed database systems as the core material and a set of selected topics based on the new developments and research interests, such as object-oriented data models and systems, extended relational systems, deductive database systems, and security and integrity.",3,"","","Prerequisite: CMPT 300 and 354, with a minimum grade of C-.","",FALSE,FALSE
"71","CMPT 456","Information Retrieval and Web Search","Introduction to the essentials of information retrieval and the applications of information retrieval in web search and web information systems. Topics include the major models of information retrieval, similarity search, text content search, link structures and web graphics, web mining and applications, crawling, search engines, and some advanced topics such as spam detection, online advertisement, and fraud detection in online auctions.",3,"","","Prerequisite: CMPT 354 with a minimum grade of C-.","",FALSE,FALSE
"72","CMPT 459","Special Topics in Database Systems","Current topics in database and information systems depending on faculty and student interest.",3,"","","Prerequisite: CMPT 354 with a minimum grade of C-.","",FALSE,FALSE
"73","CMPT 461","Computational Photography and Image Manipulation","Computational Photography is concerned with overcoming the limitations of traditional photography with computation: in optics, sensors, and geometry; and even in composition, style, and human interfaces. The course covers computational techniques to improve the way we process, manipulate, and interact with visual media. The covered topics include image-based lighting and rendering, camera geometry and optics, computational apertures, advanced image filtering operations, high-dynamic range, image blending, texture synthesis and inpainting.",3,"Students with credit for CMPT 451 may not take this course for further credit.","","Prerequisite: CMPT 361, (MACM 201 or CMPT 210), and MACM 316, all with a minimum grade of C-.","",FALSE,FALSE
"74","CMPT 464","Geometric Modelling in Computer Graphics","Covers advanced topics in geometric modelling and processing for computer graphics, such as Bezier and B-spline techniques, subdivision curves and surfaces, solid modelling, implicit representation, surface reconstruction, multi-resolution modelling, digital geometry processing (e.g. mesh smoothing, compression, and parameterization), point-based representation, and procedural modelling.",3,"Students with credit for CMPT 469 between 2003 and 2007 or equivalent may not take this course for further credit.","","Prerequisite: CMPT 361, MACM 316, both with a minimum grade of C-.","",FALSE,FALSE
"75","CMPT 466","Animation","Topics and techniques in animation, including: The history of animation, computers in animation, traditional animation approaches, and computer animation techniques such as geometric modelling, interpolation, camera controls, kinematics, dynamics, constraint-based animation, realistic motion, temporal aliasing, digital effects and post production.",3,"","","Prerequisite: CMPT 361 and MACM 316, with a minimum grade of C- or permission of the instructor.","",FALSE,FALSE
"76","CMPT 467","Visualization","Presents advanced topics in the field of scientific and information visualization. Topics include an introduction to visualization (importance, basic approaches, and existing tools), abstract visualization concepts, human perception, visualization methodology, data representation, 2D and 3D display, interactive visualization, and their use in medical, scientific, and business applications.",3,"","","Prerequisite: CMPT 361, MACM 316, both with a minimum grade of C-.","",FALSE,FALSE
"77","CMPT 469","Special Topics in Computer Graphics","Current topics in computer graphics depending on faculty and student interest.",3,"","","Prerequisite: CMPT 361 with a minimum grade of C-.","",FALSE,FALSE
"78","CMPT 470","Web-based Information Systems","This course examines: two-tier/multi-tier client/server architectures; the architecture of a Web-based information system; web servers/browser; programming/scripting tools for clients and servers; database access; transport of programming objects; messaging systems; security; and applications (such as e-commerce and on-line learning).",3,"","","Prerequisite: (CMPT 275 or CMPT 276) and CMPT 354, with a minimum grade of C-.","",FALSE,FALSE
"79","CMPT 471","Networking II","This course covers the fundamentals of higher level network functionality such as remote procedure/object calls, name/address resolution, network file systems, network security and high speed connectivity/bridging/switching.",3,"","","Prerequisite: CMPT 300 and 371, with a minimum grade of C-.","",FALSE,FALSE
"80","CMPT 473","Software Testing, Reliability and Security","Methods for software quality assurance focusing on reliability and security. Test coverage and test data adequacy including combinatorial testing. MC/DC testing, and mutation testing. Security engineering techniques for vulnerability discovery and mitigation including fuzz testing. Testing techniques will be applied to the assessment of external open source software.",3,"","","Prerequisite: (CMPT 275 or CMPT 276) with a minimum grade of C- and 15 upper division CMPT units.","",FALSE,FALSE
"81","CMPT 474","Web Systems Architecture","Web service based systems are fundamentally different from traditional software systems. The conceptual and methodological differences between a standard software development process and the development of a web service based information system. The technology involved during the construction of their own web service based application in an extensive project.",3,"","","Prerequisite: CMPT 371 with a minimum grade of C-.","",FALSE,FALSE
"82","CMPT 475","Requirements Engineering","Software succeeds when it is well-matched to its intended purpose. Requirements engineering is the process of discovering that purpose by making requirements explicit and documenting them in a form amenable to analysis, reasoning, and validation, establishing the key attributes of a system prior to its construction. Students will learn methodical approaches to requirements analysis and design specification in early systems development phases, along with best practices and common principles to cope with notoriously changing requirements. Recommended: Co-op experience.",3,"","","Prerequisite: CMPT 275 or CMPT 276, (MACM 201 or CMPT 210) , all with a minimum grade of C- and 15 units of upper division courses.","",FALSE,FALSE
"83","CMPT 477","Introduction to Formal Verification","Introduces, at an accessible level, a formal framework for symbolic model checking, one of the most important verification methods. The techniques are illustrated with examples of verification of reactive systems and communication protocols. Students learn to work with a model checking tool.",3,"","","Prerequisite: CMPT 275 or 276, with a minimum grade of C-.","",FALSE,FALSE
"84","CMPT 479","Special Topics in Computing Systems","Current topics in computing systems depending on faculty and student interest.",3,"","","Prerequisite: CMPT 300 with a minimum grade of C-.","",FALSE,FALSE
"85","CMPT 489","Special Topics in Programming Languages","Current topics in programming languages depending on faculty and student interest.",3,"","","Prerequisite: CMPT 383 with a minimum grade of C-.","",FALSE,FALSE
"86","CMPT 494","Software Systems Program Capstone Project I","This course is the first in a series of two 3 unit courses for the Software Systems Capstone Project. Students will work in teams on a closely supervised software systems project. Projects can be research based or have a significant software application, potentially based on a real customer application specification, as their basis. Students will be required to write a full project report and present their project during the Capstone Project Day Presentations. Successful Capstone Project Proposal.",3,"","","Prerequisite: Students must have completed at least 15 units of upper division CMPT courses.","",FALSE,FALSE
"87","CMPT 495","Software Systems Capstone Project II","This course is the second in a series of two 3 unit courses for the Software Systems Capstone Project. Students will work in teams or a closely supervised software systems project. Projects can be research based or have a significant software application, potentially based on a real customer specification. Students will be required to write a final project report at the end of the term and do a project presentation during the Capstone Presentation Day. CMPT 495 must be taken in the term immediately following the successful completion of CMPT 494 and must be for the same project and faculty supervisor.",3,"","","Prerequisite: CMPT 494 with a minimum grade of C-.","",FALSE,FALSE
"88","CMPT 496","Directed Studies","Independent study in topics selected in consultation with the supervising instructor(s) that are not covered by existing course offerings. Students must submit a proposal to the undergraduate chair, including the name and signature of the supervising faculty member(s). The proposal must include details of the material to be covered and the work to be submitted. 00. The proposal must be submitted to the undergraduate chair at least 15 days in advance of the term. The proposal must be signed by the supervisor(s) and the undergraduate chair.",3,"","","Prerequisite: Students must have completed 90 units, including 15 units of upper division CMPT courses, and have a GPA of at least 3.","",FALSE,FALSE
"89","CMPT 497","Dual Degree Program Capstone Project","Students will select one project to be completed in their final year of study. Each student must complete a project report and make a project presentation. The project may include: a research survey, a project implementation, a research paper/report.",6,"","","Prerequisite: Submission of a satisfactory capstone project proposal.","",FALSE,FALSE
"90","CMPT 498","Honours Research Project","Students must submit a proposal to the Undergraduate Chair, including the name and signature of the supervising faculty member(s). Students must complete a project report and make a project presentation. This course can satisfy the research project requirements for Computing Science honours students. 00. The proposal must be submitted to the Undergraduate Chair at least 15 days in advance of the term. The proposal must be signed by the supervisor(s) and the undergraduate chair.",6,"","","Prerequisite: Students must have completed 90 units, including 15 units of upper division CMPT courses, and have a GPA of at least 3.","",FALSE,FALSE
"91","CMPT 499","Special Topics in Computer Hardware","Current topics in computer hardware depending on faculty and student interest.",3,"","","Prerequisite: CMPT 250 or ENSC 250, with a minimum grade of C-.","",FALSE,FALSE
"92","CMPT 626","Graduate Co-op I","This course is the first term of work experience in the School of Computing Science Co-operative Education Program for graduate students. Units of this course do not count towards computing science breadth requirements. Graded on a satisfactory/unsatisfactory basis. 0. Department Consent is required for enrollment.",3,"","","Prerequisite: 12 units of CMPT coursework at the 700-level or higher with a CGPA of at least 3.","",FALSE,FALSE
"93","CMPT 627","Graduate Co-op II","This course is the second term of work experience in the School of Computing Science Co-operative Education Program for graduate students. Units of this course do not count towards computing science breadth requirements. Graded on a satisfactory/unsatisfactory basis. 0. Department Consent is required for enrollment.",3,"","","Prerequisite: CMPT 626 and a CGPA of at least 3.","",FALSE,FALSE
"94","CMPT 628","Graduate Co-op III","This course is the third term of work experience in the School of Computing Science Co-operative Education Program for graduate students. Units of this course do not count towards computing science breadth requirements. Graded on a satisfactory/unsatisfactory basis. 0. Department Consent is required for enrollment.",3,"","","Prerequisite: CMPT 627 and a CGPA of at least 3.","",FALSE,FALSE
"95","CMPT 629","Graduate Project","Graded on a satisfactory/unsatisfactory basis.",3,"","","Prerequisite: Permission of the Graduate Program Chair.","",FALSE,FALSE
"96","CMPT 631","Industrial Internship","An internship in industry or a research environment for graduate research students. A final report will be submitted and graded by the student's supervisor. Units of this course do not count towards computing science breadth requirements. Graded on a satisfactory/unsatisfactory basis. 0. Approval of supervisor and a GPC representative is required prior to applying for, or accepting an internship.",3,"","","Prerequisite: 12 units of CMPT course work with an SFU CGPA of at least 3.","",FALSE,FALSE
"97","CMPT 700","Technical Writing and Research Communication","Covers technical writing and communication skills for research in computing science. Introduces students to scholarly publication procedures, research collaboration norms, ethics and intellectual property issues, as well as broadly useful tools for writing about and presenting research. Includes research seminar attendance and practicing constructive critique and feedback for ongoing research. The objective is to train well-rounded graduate students, to advance their ability to communicate and review scientific research, to introduce broadly used research software tools, and to become knowledgeable about issues surrounding computing science research.",3,"","","","",FALSE,FALSE
"98","CMPT 701","Computability and Logic","Deep connections between logic and computation have been evident since early work in both areas. More recently, logic-based methods have led to important progress in diverse areas of computing science. This course will provide a foundation in logic and computability suitable for students who wish to understand the application of logic in various areas of CS, or as preparation for more advanced study in logic or theoretical CS.",3,"","","","",FALSE,FALSE
"99","CMPT 705","Design and Analysis of Algorithms","The objective of this course is to expose students to basic techniques in algorithm design and analysis. Topics will include greedy algorithms, dynamic programming, advanced data structures, network flows, randomized algorithms.",3,"Students with credit for CMPT 706 may not take this course for further credit.","","","",FALSE,FALSE
"100","CMPT 706","Design and Analysis of Algorithms for Big Data","Concepts and problem-solving techniques that are used in the design and analysis of efficient algorithms. Special consideration and adaptations for big data applications will be emphasized.",3,"Students with credit for CMPT 705 may not take this course for further credit.","","","",FALSE,FALSE
