"","Course Code","Course Name","Course Description","Credit Amount","Antirequisite","Corequisite","Prerequisite","Breadth Category","Quantitative Requirement","Writing Requirement"
"1","CMPT 102","Introduction to Scientific Computer Programming","A programming course which will provide the science student with a working knowledge of a scientific programming language and an introduction to computing concepts, structured programming, and modular design. The student will also gain knowledge in the use of programming environments including the use of numerical algorithm packages. Students who have taken CMPT 125, 129 or 135 first may not then take this course for further credit. Quantitative.",3,"Students with credit for CMPT 120, 128, 130 or 166 may not take this course for further credit.","Corequisite: MATH 152 or 155 (or 158).","","",TRUE,FALSE
"2","CMPT 105W","Social Issues and Communication Strategies in Computing Science","This course teaches the fundamentals of informative and persuasive communication for professional engineers and computer scientists. A principal goal of this course is to assist students in thinking critically about various contemporary technical, social, and ethical issues. It focuses on communicating technical information clearly and concisely, managing issues of persuasion when communicating with diverse audiences, presentation skills, and teamwork.",3,"Students with credit for ENSC 102, ENSC 105W, MSE 101W or SEE 101W may not take CMPT 105W for further credit.","","","",FALSE,TRUE
"3","CMPT 106","Applied Science, Technology and Society","Reviews the different modes of thought characteristic of science, engineering and computing. Examines the histories and chief current research issues in these fields. Considers the ethical and social responsibilities of engineering and computing work.",3,"Students with credit for ENSC 100, ENSC 106 or MSE 102 cannot take this course for further credit.","","","",FALSE,FALSE
"4","CMPT 110","Programming in Visual Basic","Topics will include user interfaces, objects, event-driven programming, program design, and file and data management. Students who have obtained credit for, or are currently enrolled in a computing science course at the 200-level or higher, or ITEC 240, 241 or 242 may not take CMPT 110 for further credit except with permission of the School of Computing Science. Quantitative.",3,"","","Prerequisite: BC Mathematics 12 (or equivalent) or any 100-level MATH course with a minimum grade of C-.","",TRUE,FALSE
"5","CMPT 115","Exploring Computer Science","You will be exploring fundamental ideas in Computer Science, and the far-reaching impact of computational thinking on modern society. Programming is not the focus, but you will do a bit of programming to actively experience the computational point of view on the world, creating applications in AI and robotics using friendly visual programming languages. No prior computing experience required. Students who have taken CMPT 120, 125, 127, 130, 135 or 170, or IAT 265 or 267 first may not then take this course for further credit.",3,"Students who have taken CMPT 120, 125, 127, 130, 135 or 170, or IAT 265 or 267 first may not then take this course for further credit.","","","Breadth-Science.",FALSE,FALSE
"6","CMPT 118","Special Topics in Computer and Information Technology","Special topics in computing science which are of current interest to non-computing students. The course will be offered from time to time depending on availability of faculty and on student interest. Students who have obtained credit for, or are currently enrolled in a computing science course at the 200-level or higher, may not take CMPT 118 for further credit.",3,"","","","",FALSE,FALSE
"7","CMPT 120","Introduction to Computing Science and Programming I","An elementary introduction to computing science and computer programming, suitable for students with little or no programming background. Students will learn fundamental concepts and terminology of computing science, acquire elementary skills for programming in a high-level language, e.g. Python. The students will be exposed to diverse fields within, and applications of computing science. Topics will include: pseudocode; data types and control structures; fundamental algorithms; recursion; reading and writing files; measuring performance of algorithms; debugging tools; basic terminal navigation using shell commands. Treatment is informal and programming is presented as a problem-solving tool. Students who have taken CMPT 125, 129, 130 or 135 first may not then take this course for further credit. Quantitative/",3,"Students with credit for CMPT 102, 128, 130 or 166 may not take this course for further credit.","","Prerequisite: BC Math 12 or equivalent is recommended.","Breadth-Science.",FALSE,FALSE
"8","CMPT 125","Introduction to Computing Science and Programming II","A rigorous introduction to computing science and computer programming, suitable for students who already have some background in computing science and programming. Intended for students who will major in computing science or a related program. Topics include: memory management; fundamental algorithms; formally analyzing the running time of algorithms; abstract data types and elementary data structures; object-oriented programming and software design; specification and program correctness; reading and writing files; debugging tools; shell commands. Quantitative.",3,"Students with credit for CMPT 126, 129, 135 or CMPT 200 or higher may not take this course for further credit.","","Prerequisite: CMPT 120 or CMPT 130, with a minimum grade of C-.","",TRUE,FALSE
"9","CMPT 128","Introduction to Computing Science and Programming for Engineers","An introduction to computing science and computer programming, suitable for students wishing to major in Engineering Science or a related program. This course introduces basic computing science concepts, and fundamentals of object oriented programming. Topics include: fundamental algorithms and problem solving; abstract data types and elementary data structures; basic object-oriented programming and software design; elements of empirical and theoretical algorithmics; computation and computability; specification and program correctness; and history of computing science. The course will use a programming language commonly used in Engineering Science. Students who have taken CMPT 125, 129, 135, or CMPT 200 or higher first may not then take this course for further credit. Quantitative/",3,"Students with credit for CMPT 102, 120, 130 or 166 may not take this course for further credit.","","Prerequisite: BC Math 12 (or equivalent, or any of MATH 100, 150, 151, 154, or 157, with a minimum grade of C-).","Breadth-Science.",FALSE,FALSE
"10","CMPT 129","Introduction to Computing Science and Programming for Mathematics and Statistics","A second course in computing science and programming intended for students studying mathematics, statistics or actuarial science and suitable for students who already have some background in computing science and programming. Topics include: a review of the basic elements of programming: use and implementation of elementary data structures and algorithms; fundamental algorithms and problem solving; basic object-oriented programming and software design; computation and computability and specification and program correctness. Quantitative.",3,"Students with credit for CMPT 125 or 135 may not take this course for further credit.","","Prerequisite: CMPT 102 or CMPT 120, with a minimum grade of C-.","",TRUE,FALSE
"11","CMPT 130","Introduction to Computer Programming I","An introduction to computing science and computer programming, using a systems oriented language, such as C or C++. This course introduces basic computing science concepts. Topics will include: elementary data types, control structures, functions, arrays and strings, fundamental algorithms, computer organization and memory management. Students who have taken CMPT 125, 129 or 135 first may not then take this course for further credit. Quantitative/",3,"Students with credit for CMPT 102, 120, 128 or 166 may not take this course for further credit.","","Prerequisite: BC Math 12 (or equivalent, or any of MATH 100, 150, 151, 154, or 157, with a minimum grade of C-).","Breadth-Science.",FALSE,FALSE
"12","CMPT 135","Introduction to Computer Programming II","A second course in systems-oriented programming and computing science that builds upon the foundation set in CMPT 130 using a systems-oriented language such as C or C++. Topics: a review of the basic elements of programming; introduction to object-oriented programming (OOP); techniques for designing and testing programs; use and implementation of elementary data structures and algorithms; introduction to embedded systems programming. Quantitative.",3,"Students with credit for CMPT 125, 126, or 129 may not take this course for further credit.","","Prerequisite: CMPT 130 with a minimum grade of C-.","",TRUE,FALSE
"13","CMPT 165","Introduction to the Internet and the World Wide Web","We shall examine the structure of the Internet and the World Wide Web as well as design and create web sites. Students who have obtained credit for, or are currently enrolled in a CMPT course at the 200-division or higher, CMPT 125, 135 or 170, or IAT 265 or 267 may not take CMPT 165 for further credit.",3,"","","","Breadth-Science.",FALSE,FALSE
"14","CMPT 166","An Animated Introduction to Programming","An informal introduction to programming using examples drawn from animation and graphics. Fundamental programming language features are covered, including variables, expressions, statements, loops, functions, and objects. Class design, event-driven programming or other advanced programming techniques may be introduced as needed. No prior programming experience is assumed. Students who have taken CMPT 125, 129 or 135 first may not then take this course for further credit. Quantitative/",3,"Students with credit for CMPT 102, 120, 128 or 130 may not take this course for further credit.","","Prerequisite: Recommended: BC Math 12 or equivalent.","Breadth-Science.",FALSE,FALSE
"15","CMPT 210","Probability and Computing","Probability has become an essential tool in modern computer science with applications in randomized algorithms, computer vision and graphics, systems, data analysis, and machine learning. The course introduces the foundational concepts in probability as required by many modern applications in computing.",3,"","","Prerequisite: MACM 101, MATH 152, and MATH 240, all with a minimum grade of C-.","",FALSE,FALSE
"16","CMPT 213","Object Oriented Design in Java","An introduction to object oriented design using Java. The Java programming language is introduced, with an emphasis on its advanced features. The course covers the building blocks of object oriented design including inheritance, polymorphism, interfaces and abstract classes. A number of object oriented design patterns are presented, such as observer, iterator, and singleton. The course also teaches best-practices in code construction. It includes a basic introduction to programming event driven graphical user interfaces.",3,"Students with credit for CMPT 212 cannot take this course for further credit.","","Prerequisite: CMPT 225 with a minimum grade of C-.","",FALSE,FALSE
"17","CMPT 218","Special Topics in Computing Science","Special topics in computing science which are of current interest or are not covered in the regular curriculum will be offered from time to time depending on availability of faculty and on student interest.",3,"","","","",FALSE,FALSE
"18","CMPT 225","Data Structures and Programming","Introduction to a variety of practical and important data structures and methods for implementation and for experimental and analytical evaluation. Topics include: stacks, queues and lists; search trees; hash tables and algorithms; efficient sorting; object-oriented programming; time and space efficiency analysis; and experimental evaluation. Quantitative.",3,"","","Prerequisite: (MACM 101 and (CMPT 125, CMPT 129 or CMPT 135)) or (ENSC 251 and ENSC 252), all with a minimum grade of C-.","",TRUE,FALSE
"19","CMPT 272","Web I - Client-side Development","Introduces students to the fundamentals of client-side web programming. Students will gain experience working with markup languages such as HTML and CSS as well as define dynamic behaviour using JavaScript and TypeScript. Students will be introduced to popular front-end frameworks. The web architecture will be discussed, and web services will be invoked using basic API calls to existing REST APIs.",3,"Students with credit for CMPT 165 may not take this course for further credit.","","Prerequisite: CMPT 120 or CMPT 130 or CMPT 128, with a minimum grade of C-.","",FALSE,FALSE
"20","CMPT 275","Software Engineering I","Introduction to software engineering techniques used in analysis/design and in software project management. The course centres on a team project involving requirements gathering, object analysis and simple data normalization, use-case-driven user documentation and design followed by implementation and testing. Additionally, there is an introduction to project planning, metrics, quality assurance, configuration management, and people issues. MATH 154 or MATH 157 with at least a B+ may be substituted for MATH 151 or MATH 150.",4,"Students with credit for CMPT 276 may not take this course for further credit.","","Prerequisite: One W course, CMPT 225, (MACM 101 or (ENSC 251 and ENSC 252)) and (MATH 151 or MATH 150), all with a minimum grade of C-.","",FALSE,FALSE
"21","CMPT 276","Introduction to Software Engineering","An overview of various techniques used for software development and software project management. Major tasks and phases in modern software development, including requirements, analysis, documentation, design, implementation, testing,and maintenance. Project management issues are also introduced. Students complete a team project using an iterative development process. MATH 154 or MATH 157 with at least a B+ may be substituted for MATH 151 or MATH 150.",3,"Students with credit for CMPT 275 may not take this course for further credit.","","Prerequisite: One W course, CMPT 225, (MACM 101 or (ENSC 251 and ENSC 252)) and (MATH 151 or MATH 150), all with a minimum grade of C-.","",FALSE,FALSE
"22","CMPT 295","Introduction to Computer Systems","The curriculum introduces students to topics in computer architecture that are considered fundamental to an understanding of the digital systems underpinnings of computer systems.",3,"","","Prerequisite: Either (MACM 101 and (CMPT 125 or CMPT 135)) or (MATH 151 and CMPT 102 for students in an Applied Physics program), all with a minimum grade of C-.","",FALSE,FALSE
"23","CMPT 300","Operating Systems I","This course aims to give the student an understanding of what a modern operating system is, and the services it provides. It also discusses some basic issues in operating systems and provides solutions. Topics include multiprogramming, process management, memory management, and file systems.",3,"","","Prerequisite: CMPT 225 and (CMPT 295 or ENSC 254), all with a minimum grade of C-.","",FALSE,FALSE
"24","CMPT 305","Computer Simulation and Modelling","This course is an introduction to the modelling, analysis, and computer simulation of complex systems. Topics include analytic modelling, discrete event simulation, experimental design, random number generation, and statistical analysis.",3,"","","Prerequisite: CMPT 225, (MACM 101 or (ENSC 251 and ENSC 252)) and STAT 270, all with a minimum grade of C-.","",FALSE,FALSE
"25","CMPT 307","Data Structures and Algorithms","Design and analysis of efficient data structures and algorithms. General techniques for building and analyzing algorithms (greedy, divide & conquer, dynamic programming, network flows). Introduction to NP-completeness. MATH 154 or MATH 157 with a grade of at least B+ may be substituted for MATH 150 or MATH 151.",3,"","","Prerequisite: CMPT 225, (MACM 201 or CMPT 210), (MATH 150 or MATH 151), and (MATH 232 or MATH 240), all with a minimum grade of C-.","",FALSE,FALSE
"26","CMPT 308","Computability and Complexity","Formal models of computation such as automata and Turing machines. Decidability and undecidability. Recursion Theorem. Connections between computability and logic (Gödel’s Incompleteness). Time and space complexity classes. NP-completeness.",3,"","","Prerequisite: (MACM 201 or CMPT 210) with a minimum grade of C-.","",FALSE,FALSE
"27","CMPT 310","Introduction to Artificial Intelligence","A survey of modern approaches for artificial intelligence (AI). Provides an introduction to a variety of AI topics and prepares students for upper-level courses. Topics include: problem solving with search; adversarial game playing; probability and Bayesian networks; machine learning; and applications such as robotics, visual computing and natural language.",3,"","","Prerequisite: CMPT 225 and (MACM 101 or (ENSC 251 and ENSC 252)), all with a minimum grade of C-.","",FALSE,FALSE
"28","CMPT 318","Special Topics in Computing Science","Special topics in computing science at the 300 level. Topics that are of current interest or are not covered in regular curriculum will be offered from time to time depending on availability of faculty and student interest. Additional prerequisites to be determined by the instructor subject to approval by the undergraduate program chair.",3,"","","Prerequisite: CMPT 225 with a minimum grade of C-.","",FALSE,FALSE
"29","CMPT 320","Social Implications - Computerized Society","An examination of social processes that are being automated and implications for good and evil, that may be entailed in the automation of procedures by which goods and services are allocated. Examination of what are dehumanizing and humanizing parts of systems and how systems can be designed to have a humanizing effect.",3,"","","Prerequisite: A CMPT course with a minimum grade of C- and 45 units.","Breadth-Science.",FALSE,FALSE
"30","CMPT 322W","Professional Responsibility and Ethics","The theory and practice of computer ethics. The basis for ethical decision-making and the methodology for reaching ethical decisions concerning computing matters will be studied. Writing as a means to understand and reason about complex ethical issues will be emphasized.",3,"Students with credit for CMPT 322 may not take this course for further credit.","","Prerequisite: Three CMPT units, 30 total units, and any lower division W course.","",FALSE,TRUE
"31","CMPT 340","Biomedical Computing","The principles involved in using computers for data acquisition, real-time processing, pattern recognition and experimental control in biology and medicine will be developed. The use of large data bases and simulation will be explored.",3,"","","Prerequisite: Completion of 60 units including one of CMPT 125, 126, 128, 135, with a minimum grade of C- or CMPT 102 with a grade of B or higher.","",FALSE,FALSE
"32","CMPT 353","Computational Data Science","Basic concepts and programming tools for handling and processing data. Includes data acquisition, cleaning data sources, application of machine learning techniques and data analysis techniques, large-scale computation on a computing cluster.",3,"","","Prerequisite: CMPT 225 and (STAT 101, STAT 270, ENSC 280, or MSE 210), with a minimum grade of C-.","",FALSE,FALSE
"33","CMPT 354","Database Systems I","Logical representations of data records. Data models. Studies of some popular file and database systems. Document retrieval. Other related issues such as database administration, data dictionary and security.",3,"","","Prerequisite: CMPT 225 and (MACM 101 or (ENSC 251 and ENSC 252)), all with a minimum grade of C-.","",FALSE,FALSE
"34","CMPT 361","Introduction to Computer Graphics","This course provides an introduction to the fundamentals of computer graphics. Topics include graphics display and interaction hardware, basic algorithms for 2D primitives, anti-aliasing, 2D and 3D geometrical transformations, 3D projections/viewing, Polygonal and hierarchical models, hidden-surface removal, basic rendering techniques (color, shading, raytracing, radiosity), and interaction techniques.",3,"","","Prerequisite: CMPT 225 and MATH 232 or 240, all with a minimum grade of C-.","",FALSE,FALSE
"35","CMPT 362","Mobile Applications Programming and Design","Teaches students how to design and implement smartphone applications. Topics include development environment, phone emulator, key programming paradigms, UI design including views, fragments, and activities, data persistence, threads, services, embedded sensors, and location based services (e.g., Google Maps). Concepts are reinforced through programming assignments and group projects.",3,"Students with credit for IAT 359 may not take this course for further credit.","","Prerequisite: CMPT 225 with a minimum grade of C-.","",FALSE,FALSE
"36","CMPT 363","User Interface Design","This course provides a comprehensive study of user interface design. Topics include: goals and principles of UI design (systems engineering and human factors), historical perspective, current paradigms (widget-based, mental model, graphic design, ergonomics, metaphor, constructivist/iterative approach, and visual languages) and their evaluation, existing tools and packages (dialogue models, event-based systems, prototyping), future paradigms, and the social impact of UI.",3,"","","Prerequisite: CMPT 225 with a minimum grade of C-.","",FALSE,FALSE
"37","CMPT 365","Multimedia Systems","Multimedia systems design, multimedia hardware and software, issues in effectively representing, processing, and retrieving multimedia data such as text, graphics, sound and music, image and video.",3,"","","Prerequisite: CMPT 225 with a minimum grade of C-.","",FALSE,FALSE
"38","CMPT 371","Data Communications and Networking","Data communication fundamentals (data types, rates, and transmission media). Network architectures for local and wide areas. Communications protocols suitable for various architectures. ISO protocols and internetworking. Performance analysis under various loadings and channel error rates. MATH 154 or MATH 157 with a grade of at least B+ may be substituted for MATH 151 (MATH 150).",3,"","","Prerequisite: CMPT 225 and (MATH 151 or MATH 150), with a minimum grade of C-.","",FALSE,FALSE
"39","CMPT 372","Web II - Server-side Development","Introduces students to the fundamentals of server-side web development. Students will gain experience working with backend web frameworks, designing and implementing web APIs, and deploying web systems. Students will be introduced to popular back-end frameworks. The course will focus on the design, creating, implementation, and deployment of backend systems, including APIs.",3,"Students with credit for CMPT 470 may not take this course for further credit.","","Prerequisite: CMPT 272 and CMPT 225, both with a minimum grade of C-.","",FALSE,FALSE
"40","CMPT 373","Software Development Methods","Survey of modern software development methodology. Several software development process models will be examined, as will the general principles behind such models. Provides experience with different programming paradigms and their advantages and disadvantages during software development.",3,"","","Prerequisite: CMPT 276 or 275, with a minimum grade of C-.","",FALSE,FALSE
"41","CMPT 376W","Technical Writing and Group Dynamics","Covers professional writing in computing science, including format conventions and technical reports. Attention is paid to group dynamics, including team leadership, dispute resolution, cognitive bias, professional ethics and collaborative writing. Research methods are also discussed. The use of LaTeX and various version control tools are emphasized.",3,"Students with credit for CMPT 376 may not take this course for further credit.","","Prerequisite: CMPT 105W and (CMPT 275 or CMPT 276), with a minimum grade of C-.","",FALSE,TRUE
"42","CMPT 379","Principles of Compiler Design","This course covers the key components of a compiler for a high level programming language. Topics include lexical analysis, parsing, type checking, code generation and optimization. Students will work in teams to design and implement an actual compiler making use of tools such as lex and yacc.",3,"","","Prerequisite: (MACM 201 or CMPT 210), (CMPT 295 or ENSC 215) and CMPT 225, all with a minimum grade of C-.","",FALSE,FALSE
"43","CMPT 383","Comparative Programming Languages","Various concepts and principles underlying the design and use of modern programming languages are considered in the context of procedural, object-oriented, functional and logic programming languages. Topics include data and control structuring constructs, facilities for modularity and data abstraction, polymorphism, syntax, and formal semantics.",3,"","","Prerequisite: CMPT 225 and (MACM 101 or (ENSC 251 and ENSC 252)), all with a minimum grade of C-.","",FALSE,FALSE
"44","CMPT 384","Symbolic Computing","This course considers modelling and programming techniques appropriate for symbolic data domains such as mathematical expressions, logical formulas, grammars and programming languages. Topics include recursive and functional programming style, grammar-based data abstraction, simplification and reduction transformations, conversions to canonical form, environment data structures and interpreters, metaprogramming, pattern matching and theorem proving.",3,"","","Prerequisite: CMPT 225 and (MACM 101 or (ENSC 251 and ENSC 252)), all with a minimum grade of C-.","",FALSE,FALSE
